id,name,type,display_type,activity_type_display_name,private,bike_id,athlete_gear_id,start_date,start_date_local_raw,start_time,start_day,distance,distance_raw,long_unit,short_unit,moving_time,moving_time_raw,elapsed_time,elapsed_time_raw,trainer,static_map,has_latlng,commute,elevation_gain,elevation_unit,elevation_gain_raw,description,activity_url,activity_url_for_twitter,twitter_msg,is_new,is_changing_type,suffer_score,workout_type,flagged,hide_power,hide_heartrate,leaderboard_opt_out,visibility
2548465794,"wu, 5 x (3x300m), cd ",Run,Run,Run,false,,4669047,"Sat, 7/20/2019",1563620820,2019-07-20T15:07:00+0000,Sat,8.30,8300,kilometers,km,41:30,2490,41:30,2490,false,,false,false,0,m,0,,https://www.strava.com/activities/2548465794,https://www.strava.com/activities/2548465794?utm_content=36052432&utm_medium=referral&utm_source=twitter,went for a 8.3 kilometer Run.,false,false,,,false,false,false,false,everyone
2546570922,Night Run,Run,Run,Run,false,,4669047,"Fri, 7/19/2019",1563570915,2019-07-20T01:15:15+0000,Fri,6.32,6321.38,kilometers,km,31:34,1894,31:47,1907,false,https://d3o5xota0a1fcr.cloudfront.net/v6/maps/MLCIWCAPFTR2ERQOCP5Y6UBUMLJLSWOX37FPDSATX2GMB4KJ4DLV3J3R52DXDHSSP5DM3XLOINTD7OUFN6SFPJSWAQZ72EVD,true,false,27,m,26.7726,,https://www.strava.com/activities/2546570922,https://www.strava.com/activities/2546570922?utm_content=36052432&utm_medium=referral&utm_source=twitter,went for a 6.3 kilometer Run.,false,false,,0,false,false,false,false,everyone
2544323793,Night Run,Run,Run,Run,false,,4669047,"Thu, 7/18/2019",1563488188,2019-07-19T02:16:28+0000,Thu,6.02,6021.78,kilometers,km,30:01,1801,30:11,1811,false,https://d3o5xota0a1fcr.cloudfront.net/v6/maps/HGFT62SZ22FIFEBKLN4R52E5CRGFWZY2RMZYZXW4YUEWHDCGQ7A3ZJCIUMDUNCA7WT2QHKY24ZW5O6FS5OSR7IVIP6PREH46,true,false,18,m,18.1,,https://www.strava.com/activities/2544323793,https://www.strava.com/activities/2544323793?utm_content=36052432&utm_medium=referral&utm_source=twitter,went for a 6.0 kilometer Run.,false,false,,0,false,false,false,false,everyone
2541375611,"wu, 3 x 800m @tempo, 3 x 100m hills, cd ",Run,Run,Run,false,,4669047,"Wed, 7/17/2019",1563391428,2019-07-17T23:23:48+0000,Wed,5.90,5900,kilometers,km,29:30,1770,29:30,1770,false,,false,false,0,m,0,,https://www.strava.com/activities/2541375611,https://www.strava.com/activities/2541375611?utm_content=36052432&utm_medium=referral&utm_source=twitter,went for a 5.9 kilometer Run.,false,false,,0,false,false,false,false,everyone
2541305130,Post-Ice Cream Run,Run,Run,Run,false,,4669047,"Wed, 7/17/2019",1563386405,2019-07-17T22:00:05+0000,Wed,8.60,8599.56,kilometers,km,39:59,2399,40:04,2404,false,https://d3o5xota0a1fcr.cloudfront.net/v6/maps/2LWMKEN2FLGF3Z346HETD37EUVMOUHJXKE2GWSJ3XSVKSMJTF2TS6TISNAGWG6HFZSV5FIK5C7RZB45BAH44KWRIM7PS4AJX,true,false,49,m,49.2863,10/10 do not recommend,https://www.strava.com/activities/2541305130,https://www.strava.com/activities/2541305130?utm_content=36052432&utm_medium=referral&utm_source=twitter,went for a 8.6 kilometer Run.,false,false,,0,false,false,true,false,everyone
2535546983,"wu, 3 x (2x200m + 1600m), cd ",Run,Run,Run,false,,4669047,"Mon, 7/15/2019",1563219900,2019-07-15T23:45:00+0000,Mon,9.10,9100,kilometers,km,45:30,2730,45:30,2730,false,,false,false,0,m,0,"200’s @ 1500 pace, 1600 @ tempo",https://www.strava.com/activities/2535546983,https://www.strava.com/activities/2535546983?utm_content=36052432&utm_medium=referral&utm_source=twitter,went for a 9.1 kilometer Run.,false,false,,3,false,false,false,false,everyone
2529005682,Lunch Run,Run,Run,Run,false,,4669047,"Sat, 7/13/2019",1563018741,2019-07-13T15:52:21+0000,Sat,10.84,10847.8,kilometers,km,49:54,2994,51:17,3077,false,https://d3o5xota0a1fcr.cloudfront.net/v6/maps/E4OTTX2BTEQRAOIV6JYGHSBR4A5SOEI4DQXQYBVMAYFSMUATFQDAEW7NAKTOLJ5O2QIXEJOEI35JQNFMZ247DBWG6SMRHD7M,true,false,27,m,27.1548,,https://www.strava.com/activities/2529005682,https://www.strava.com/activities/2529005682?utm_content=36052432&utm_medium=referral&utm_source=twitter,went for a 10.8 kilometer Run.,false,false,,0,false,false,false,false,everyone
2526877158,Evening Run,Run,Run,Run,false,,4669047,"Fri, 7/12/2019",1562958071,2019-07-12T23:01:11+0000,Fri,6.34,6343.72,kilometers,km,28:45,1725,30:11,1811,false,https://d3o5xota0a1fcr.cloudfront.net/v6/maps/7XBMHB6MYATJ4QNIGP42QRKTYN6TYZVUN7XDTZHDAI2PSG4BTGJKBF3BC5CBNG6AJL42N7WXF3QWDU6VVOXBIWTEJZCGDWU7,true,false,33,m,32.7452,,https://www.strava.com/activities/2526877158,https://www.strava.com/activities/2526877158?utm_content=36052432&utm_medium=referral&utm_source=twitter,went for a 6.3 kilometer Run.,false,false,,0,false,false,false,false,everyone
2521872298,"wu, 5 x (4 x 200m), cd ",Run,Run,Run,false,,4669047,"Wed, 7/10/2019",1562780211,2019-07-10T21:36:51+0000,Wed,6.50,6500,kilometers,km,30:00,1800,30:00,1800,false,,false,false,0,m,0,,https://www.strava.com/activities/2521872298,https://www.strava.com/activities/2521872298?utm_content=36052432&utm_medium=referral&utm_source=twitter,went for a 6.5 kilometer Run.,false,false,,3,false,false,false,false,everyone
2521642841,Afternoon Run,Run,Run,Run,false,,4669047,"Wed, 7/10/2019",1562778509,2019-07-10T21:08:29+0000,Wed,1.62,1619.95,kilometers,km,7:49,469,7:49,469,false,https://d3o5xota0a1fcr.cloudfront.net/v6/maps/JZU73Q3JZTJ7HCGLACHYGHZVQ5I76K6DENDCCKCROE2LV7OESG2R7LUBLG2MWKNU2VNLGY7LUWTZUZZHU3LTNKJUONVXTJR3,true,false,9,m,9.28571,,https://www.strava.com/activities/2521642841,https://www.strava.com/activities/2521642841?utm_content=36052432&utm_medium=referral&utm_source=twitter,went for a 1.6 kilometer Run.,false,false,,0,false,false,false,false,everyone
2519346738,Night Run,Run,Run,Run,false,,4669047,"Tue, 7/9/2019",1562696595,2019-07-10T01:23:15+0000,Tue,8.50,8500,kilometers,km,40:43,2443,40:43,2443,false,,false,false,0,m,0,Easy Run. ,https://www.strava.com/activities/2519346738,https://www.strava.com/activities/2519346738?utm_content=36052432&utm_medium=referral&utm_source=twitter,went for a 8.5 kilometer Run.,false,false,,0,false,false,false,false,everyone
2518717607,"wu, 5x400m, 3x100m, cd ",Run,Run,Run,false,,4669047,"Mon, 7/8/2019",1562601651,2019-07-08T23:00:51+0000,Mon,6.20,6200,kilometers,km,30:00,1800,30:00,1800,false,,false,false,0,m,0,First time in spikes since injury.,https://www.strava.com/activities/2518717607,https://www.strava.com/activities/2518717607?utm_content=36052432&utm_medium=referral&utm_source=twitter,went for a 6.2 kilometer Run.,false,false,,3,false,false,false,true,followers_only
2746999885,"wu, 4 x 1km @tempo, cd",Run,Run,Run,false,,4750982,"Thu, 9/26/2019",1569524520,2019-09-26T23:02:00+0000,Thu,7.60,7600,kilometers,km,32:49,1969,32:49,1969,false,,false,false,0,m,0,On the track. 1 min rest.,https://www.strava.com/activities/2746999885,https://www.strava.com/activities/2746999885?utm_content=36052432&utm_medium=referral&utm_source=twitter,went for a 7.6 kilometer Run.,false,false,,3,false,false,false,false,everyone
2739888223,"warmup, cooldown ",Run,Run,Run,false,,4750982,"Wed, 9/25/2019",1569424440,2019-09-25T19:14:00+0000,Wed,4.20,4200,kilometers,km,20:31,1231,20:31,1231,false,,false,false,0,m,0,,https://www.strava.com/activities/2739888223,https://www.strava.com/activities/2739888223?utm_content=36052432&utm_medium=referral&utm_source=twitter,went for a 4.2 kilometer Run.,false,false,,,false,false,false,false,everyone
2739879830,Gryphon Open,Run,Run,Run,false,,4750982,"Wed, 9/25/2019",1569421853,2019-09-25T18:30:53+0000,Wed,5.00,5000,kilometers,km,19:51,1191,19:51,1191,false,,false,false,0,m,0,11th overall,https://www.strava.com/activities/2739879830,https://www.strava.com/activities/2739879830?utm_content=36052432&utm_medium=referral&utm_source=twitter,went for a 5.0 kilometer Run.,false,false,,1,false,false,false,false,everyone
2739867260,"wu, fartlek workout, cd",Run,Run,Run,false,,4750982,"Mon, 9/23/2019",1569265233,2019-09-23T23:00:33+0000,Mon,12.30,12300,kilometers,km,57:01,3421,57:01,3421,false,,false,false,0,m,0,,https://www.strava.com/activities/2739867260,https://www.strava.com/activities/2739867260?utm_content=36052432&utm_medium=referral&utm_source=twitter,went for a 12.3 kilometer Run.,false,false,,,false,false,false,false,everyone
2734379640,School Practice ,Run,Run,Run,false,,4750982,"Mon, 9/23/2019",1569254851,2019-09-23T20:07:31+0000,Mon,4.50,4500,kilometers,km,20:33,1233,20:33,1233,false,,false,false,0,m,0,Feeling really sick today.,https://www.strava.com/activities/2734379640,https://www.strava.com/activities/2734379640?utm_content=36052432&utm_medium=referral&utm_source=twitter,went for a 4.5 kilometer Run.,false,false,,,false,false,false,false,everyone
2727890426,Camp Fortune Long Run ,Run,Run,Run,false,,4750982,"Sat, 9/21/2019",1569056910,2019-09-21T13:08:30+0000,Sat,18.00,18001.2,kilometers,km,1:18:13,4693,1:27:02,5222,false,https://d3o5xota0a1fcr.cloudfront.net/v6/maps/5ZQ2KFBT75YN3BUYUKSRLYHM66ETRVWJ63L3RV2GR5Z7OASXP6GDHH6WOOXQA3GIDMO6CKZAVBYGQHNTVJRPDMYUFHNNBE7O,true,false,306,m,305.575,with Adam & Seb,https://www.strava.com/activities/2727890426,https://www.strava.com/activities/2727890426?utm_content=36052432&utm_medium=referral&utm_source=twitter,went for a 18.0 kilometer Run.,false,false,,0,false,false,false,false,everyone
2726057886,Afternoon Run,Run,Run,Run,false,,4750982,"Fri, 9/20/2019",1569002068,2019-09-20T21:54:28+0000,Fri,10.05,10056,kilometers,km,44:10,2650,44:45,2685,false,https://d3o5xota0a1fcr.cloudfront.net/v6/maps/OLJFUHN56CAK6MO7EGZJHZ5LF7X7KYCN5EQJOFXYHHMWYVURJLBEJ6HVNQCE4IL7JTKZZPW6EZBHYS2T36W4NFRA3YKAXT6H,true,false,26,m,26.1833,,https://www.strava.com/activities/2726057886,https://www.strava.com/activities/2726057886?utm_content=36052432&utm_medium=referral&utm_source=twitter,went for a 10.0 kilometer Run.,false,false,,0,false,false,false,false,everyone
2723909835,"wu, 10 mins @ tempo, 5 x hill loops, cd ",Run,Run,Run,false,,4750982,"Thu, 9/19/2019",1568926367,2019-09-20T00:52:47+0000,Thu,11.10,11100,kilometers,km,50:45,3045,50:45,3045,false,,false,false,0,m,0,,https://www.strava.com/activities/2723909835,https://www.strava.com/activities/2723909835?utm_content=36052432&utm_medium=referral&utm_source=twitter,went for a 11.1 kilometer Run.,false,false,,,false,false,false,false,everyone
2721029943,Evening Run,Run,Run,Run,false,,4750982,"Wed, 9/18/2019",1568834503,2019-09-18T23:21:43+0000,Wed,10.60,10601,kilometers,km,48:49,2929,56:31,3391,false,https://d3o5xota0a1fcr.cloudfront.net/v6/maps/L7PBK3KKQL4DJE6QE5M5WHZDHTZW4FPIV44BPJPJ74OWESZYMMP2JDFTRHJOPQOPAO7QAKI722VTSATQHRIZWSY73GOB33OH,true,false,26,m,26.1244,,https://www.strava.com/activities/2721029943,https://www.strava.com/activities/2721029943?utm_content=36052432&utm_medium=referral&utm_source=twitter,went for a 10.6 kilometer Run.,false,false,,0,false,false,false,false,everyone
2713360190,Morning Run,Run,Run,Run,false,,4750982,"Mon, 9/16/2019",1568615223,2019-09-16T10:27:03+0000,Mon,8.82,8828.06,kilometers,km,40:16,2416,44:12,2652,false,https://d3o5xota0a1fcr.cloudfront.net/v6/maps/FI5FX5S4RF3DC7WVQDKSRT7LM3NLWOXSDTPT5LCQYP6JV4MDHRHUKNLPB5KBDPOHS26ZC6ECICAA5QYDHVAANW6OPL7AQ5KG,true,false,23,m,22.8006,,https://www.strava.com/activities/2713360190,https://www.strava.com/activities/2713360190?utm_content=36052432&utm_medium=referral&utm_source=twitter,went for a 8.8 kilometer Run.,false,false,,0,false,false,false,false,everyone
2712332633,Afternoon Run,Run,Run,Run,false,,4750982,"Sun, 9/15/2019",1568564755,2019-09-15T20:25:55+0000,Sun,9.13,9137.53,kilometers,km,39:40,2380,41:43,2503,false,https://d3o5xota0a1fcr.cloudfront.net/v6/maps/RGCWIPUSFAJTRZOWDIDBQTOC26XV73VUCOQJD3MEWDDN3EDCF2ML3GJSI4LUHWRG777FATULKVQKWFNZX6OQNMFWHOE73ZGW,true,false,24,m,24.1571,,https://www.strava.com/activities/2712332633,https://www.strava.com/activities/2712332633?utm_content=36052432&utm_medium=referral&utm_source=twitter,went for a 9.1 kilometer Run.,false,false,,0,false,false,false,false,everyone
2707861985,Camp Fortune Long Run,Run,Run,Run,false,,4750982,"Sat, 9/14/2019",1568452162,2019-09-14T13:09:22+0000,Sat,15.01,15017.2,kilometers,km,1:12:18,4338,1:12:18,4338,false,https://d3o5xota0a1fcr.cloudfront.net/v6/maps/KIDDXZNGTVVCHFRTVT74R3F2253YY47I2V5NLUKLK3AXPK6AOCKDJVFXPTETMV6BYRR6UBXEBLXLCODPH2SRPZXQJPLCYYXK,true,false,269,m,268.819,"Avg HR 153, kinda sore from hills on Thursday.",https://www.strava.com/activities/2707861985,https://www.strava.com/activities/2707861985?utm_content=36052432&utm_medium=referral&utm_source=twitter,went for a 15.0 kilometer Run.,false,false,,2,false,false,false,false,everyone
2705835025,Recovery Run,Run,Run,Run,false,,4750982,"Fri, 9/13/2019",1568395221,2019-09-13T21:20:21+0000,Fri,8.33,8338.26,kilometers,km,39:34,2374,44:55,2695,false,https://d3o5xota0a1fcr.cloudfront.net/v6/maps/TPCPLQQZ5LMFGTUYUIDXOD5ND2HYETBL6C2OYY3UQPBDLMQHF3Y2JFOH72CD7GG5YUSH36VRBY22KGFJBYRTAIMWTEQTQTFO,true,false,24,m,23.7149,,https://www.strava.com/activities/2705835025,https://www.strava.com/activities/2705835025?utm_content=36052432&utm_medium=referral&utm_source=twitter,went for a 8.3 kilometer Run.,false,false,,0,false,false,true,false,everyone
2703748903,"wu, 10 x 1min hill loop repeats, cd ",Run,Run,Run,false,,4750982,"Thu, 9/12/2019",1568326080,2019-09-13T02:08:00+0000,Thu,9.50,9500,kilometers,km,43:57,2637,43:57,2637,false,,false,false,0,m,0,,https://www.strava.com/activities/2703748903,https://www.strava.com/activities/2703748903?utm_content=36052432&utm_medium=referral&utm_source=twitter,went for a 9.5 kilometer Run.,false,false,,,false,false,false,false,everyone
2700275354,Afternoon Run,Run,Run,Run,false,,4750982,"Wed, 9/11/2019",1568214875,2019-09-11T19:14:35+0000,Wed,9.19,9194.51,kilometers,km,40:20,2420,43:06,2586,false,https://d3o5xota0a1fcr.cloudfront.net/v6/maps/5UJADJD634JQEBCHEKJPPLMQGFY5V3JG4F7D5PF27JQCYH7VYI5Z56XQ6OIPH7VZ34WQKRQKVTXAW3MGLXPA5DNVTVUSCMYC,true,false,12,m,11.5571,,https://www.strava.com/activities/2700275354,https://www.strava.com/activities/2700275354?utm_content=36052432&utm_medium=referral&utm_source=twitter,went for a 9.1 kilometer Run.,false,false,,0,false,false,false,false,everyone
2697602306,Afternoon Run,Run,Run,Run,false,,4750982,"Tue, 9/10/2019",1568136367,2019-09-10T21:26:07+0000,Tue,9.11,9116.63,kilometers,km,40:01,2401,44:15,2655,false,https://d3o5xota0a1fcr.cloudfront.net/v6/maps/EY5J3VUGXOJLGU3FAH3Z6KZWGALA25BRATHYR4POTPVSY3N6UEAA6OO7NADPRCFWHZJ65LVPMOLZFZZXV2LKMHX4NRI4EQBU,true,false,24,m,24.2286,,https://www.strava.com/activities/2697602306,https://www.strava.com/activities/2697602306?utm_content=36052432&utm_medium=referral&utm_source=twitter,went for a 9.1 kilometer Run.,false,false,,0,false,false,false,false,everyone
2699215124,"wu, 20mins tempo workout, cd ",Run,Run,Run,false,,4750982,"Mon, 9/9/2019",1568055642,2019-09-09T23:00:42+0000,Mon,14.10,14100,kilometers,km,1:01:06,3666,1:01:06,3666,false,,false,false,0,m,0,,https://www.strava.com/activities/2699215124,https://www.strava.com/activities/2699215124?utm_content=36052432&utm_medium=referral&utm_source=twitter,went for a 14.1 kilometer Run.,false,false,,,false,false,false,false,everyone
2688779062,Afternoon Run,Run,Run,Run,false,,4750982,"Sat, 9/7/2019",1567874907,2019-09-07T20:48:27+0000,Sat,15.09,15095.8,kilometers,km,1:07:25,4045,1:10:56,4256,false,https://d3o5xota0a1fcr.cloudfront.net/v6/maps/X3UE3WPIEIGRULICYCLNWLTSDBN6M2PBLJRZWDGOPXQJ2VEXNYC2SBRWKEKDVYVLSMIJDTNFJDXHXLDIBHKCAPVQ7PE3LVPH,true,false,30,m,29.6756,,https://www.strava.com/activities/2688779062,https://www.strava.com/activities/2688779062?utm_content=36052432&utm_medium=referral&utm_source=twitter,went for a 15.0 kilometer Run.,false,false,,0,false,false,false,false,everyone
2685909656,Evening Run,Run,Run,Run,false,,4750982,"Fri, 9/6/2019",1567799494,2019-09-06T23:51:34+0000,Fri,6.95,6950.56,kilometers,km,31:35,1895,32:20,1940,false,https://d3o5xota0a1fcr.cloudfront.net/v6/maps/WA7P7KRIEPRAQEO3JN2P5IT7WWCKNBWIFWJZQ47DR7CI2WEWRSNZWMIABJ6JA4QFI7S47XFRCJQWXITVJZC7ZL55ID4I54AI,true,false,23,m,22.9695,,https://www.strava.com/activities/2685909656,https://www.strava.com/activities/2685909656?utm_content=36052432&utm_medium=referral&utm_source=twitter,went for a 6.9 kilometer Run.,false,false,,0,false,false,false,false,everyone
2683618934,10km w/ 12mins tempo,Run,Run,Run,false,,4750982,"Thu, 9/5/2019",1567712499,2019-09-05T23:41:39+0000,Thu,10.23,10231.4,kilometers,km,42:48,2568,50:01,3001,false,https://d3o5xota0a1fcr.cloudfront.net/v6/maps/QWC7RQ755N62QAED5WM54IP5MFXKRIE4S4MHCXZ2UORWMTRL5QIZU6CXSPR6PN7OTBLNHWKWDQGOHKFOOTHLOUFI5NWN6I2R,true,false,24,m,23.919,,https://www.strava.com/activities/2683618934,https://www.strava.com/activities/2683618934?utm_content=36052432&utm_medium=referral&utm_source=twitter,went for a 10.2 kilometer Run.,false,false,,0,false,false,false,false,everyone
4256478929,warmup,Run,Run,Run,false,,7198778,"Wed, 10/28/2020",1603908716,2020-10-28T22:11:56+0000,Wed,2.98,2985.76,kilometers,km,14:27,867,16:36,996,false,https://d3o5xota0a1fcr.cloudfront.net/v6/maps/6PSNKMNHKRRQKJ73A2R4DLYB2VA6V4PUND66Q2IC24WUICE2NTGEXW5YOSO4W3XWYBRMWGGGIK7SCDOTMF44I46Q4LNIFFPL,true,false,14,m,13.6667,,https://www.strava.com/activities/4256478929,https://www.strava.com/activities/4256478929?utm_content=36052432&utm_medium=referral&utm_source=twitter,went for a 2.9 kilometer Run.,false,false,,0,false,false,false,false,everyone
4252628071,Afternoon run,Run,Run,Run,false,,7198778,"Tue, 10/27/2020",1603819558,2020-10-27T21:25:58+0000,Tue,10.60,10600,kilometers,km,48:39,2919,48:39,2919,false,,false,false,0,m,0,,https://www.strava.com/activities/4252628071,https://www.strava.com/activities/4252628071?utm_content=36052432&utm_medium=referral&utm_source=twitter,went for a 10.6 kilometer Run.,false,false,,0,false,false,false,false,everyone
4244041447,Afternoon Run,Run,Run,Run,false,,7198778,"Sun, 10/25/2020",1603646657,2020-10-25T21:24:17+0000,Sun,10.51,10509,kilometers,km,43:59,2639,48:57,2937,false,https://d3o5xota0a1fcr.cloudfront.net/v6/maps/2EUVU3MP25FP73X627DGFAKLIR25S4QW7CENPT6WBIJKYY3CQEY5Y6HOX2P6DMP42BHZEEY44OTUONGEOORP4PXIJZMPU3VC,true,false,8,m,7.99048,,https://www.strava.com/activities/4244041447,https://www.strava.com/activities/4244041447?utm_content=36052432&utm_medium=referral&utm_source=twitter,went for a 10.5 kilometer Run.,false,false,,0,false,false,false,false,everyone
4237444905,Meh,Run,Run,Run,false,,7198778,"Sat, 10/24/2020",1603530485,2020-10-24T13:08:05+0000,Sat,14.30,14301.7,kilometers,km,1:02:09,3729,1:17:00,4620,false,https://d3o5xota0a1fcr.cloudfront.net/v6/maps/EYH5JQ3V4JAYNKSKKK3C35WWUHEYDDY6TEA53EMMRTAD6ZJOONEPWKV3P4QDR2YW4TZ653PMGKCQE7POWERW3HNA35QO7IKO,true,false,27,m,26.8186,I think I’ll retry this tomorrow,https://www.strava.com/activities/4237444905,https://www.strava.com/activities/4237444905?utm_content=36052432&utm_medium=referral&utm_source=twitter,went for a 14.3 kilometer Run.,false,false,,0,false,false,false,false,everyone
4234403504,Afternoon Run,Run,Run,Run,false,,7198778,"Fri, 10/23/2020",1603473867,2020-10-23T21:24:27+0000,Fri,12.72,12723.7,kilometers,km,54:34,3274,1:03:38,3818,false,https://d3o5xota0a1fcr.cloudfront.net/v6/maps/IFWFDNTHB2L3RAUWVBND4VJITD3RMBX2WS4LZHQQUYTT6D4Q5VGCXRC7TDMU3WMJAFH4UILBN5JWJAPOUTPYP4N6KSD3BQID,true,false,7,m,6.95238,"Pretty good, mild pain in right shin for the first 4km",https://www.strava.com/activities/4234403504,https://www.strava.com/activities/4234403504?utm_content=36052432&utm_medium=referral&utm_source=twitter,went for a 12.7 kilometer Run.,false,false,,0,false,false,false,false,everyone
4226673203,warmup + cooldown,Run,Run,Run,false,,6167097,"Wed, 10/21/2020",1603307100,2020-10-21T23:05:00+0000,Wed,5.10,5100,kilometers,km,24:13,1453,24:13,1453,false,,false,false,0,m,0,,https://www.strava.com/activities/4226673203,https://www.strava.com/activities/4226673203?utm_content=36052432&utm_medium=referral&utm_source=twitter,went for a 5.1 kilometer Run.,false,false,,,false,false,false,false,everyone
4234403406,6x1000m ,Run,Run,Run,false,,6167097,"Wed, 10/21/2020",1603306352,2020-10-21T22:52:32+0000,Wed,6.02,6024.56,kilometers,km,20:26,1226,30:30,1830,false,https://d3o5xota0a1fcr.cloudfront.net/v6/maps/6PZ33CSL6UKBTY6JXXSU4ICYLYGA2ZUEBFDGPSM6G2FSXDO3ZFJADJWT3P74ZB6MKVMUH2KE35D6OWU72VA65W64C5ZFBVVK,true,false,38,m,38.0333,,https://www.strava.com/activities/4234403406,https://www.strava.com/activities/4234403406?utm_content=36052432&utm_medium=referral&utm_source=twitter,went for a 6.0 kilometer Run.,false,false,,3,false,false,false,false,everyone
4218287260,cooldown,Run,Run,Run,false,,6167097,"Mon, 10/19/2020",1603136436,2020-10-19T23:40:36+0000,Mon,3.00,3000,kilometers,km,15:00,900,15:00,900,false,,false,false,0,m,0,,https://www.strava.com/activities/4218287260,https://www.strava.com/activities/4218287260?utm_content=36052432&utm_medium=referral&utm_source=twitter,went for a 3.0 kilometer Run.,false,false,,0,false,false,false,false,everyone
4218280841,tempo 4,Run,Run,Run,false,,6167097,"Mon, 10/19/2020",1603135031,2020-10-19T23:17:11+0000,Mon,1.99,1994.36,kilometers,km,7:26,446,7:33,453,false,https://d3o5xota0a1fcr.cloudfront.net/v6/maps/5H5JYOUELLQ4GJIOA4GOMD4YR74DNAL4BY2ILUVLDV56QQDAAJSZKIWY6266ILVQBGKJL2QWXCTUMRDMPROJ2LODSSWOJ2IH,true,false,19,m,18.6133,sorry for the spam,https://www.strava.com/activities/4218280841,https://www.strava.com/activities/4218280841?utm_content=36052432&utm_medium=referral&utm_source=twitter,went for a 1.9 kilometer Run.,false,false,,0,false,false,false,false,everyone
4218294462,8 Hills,Run,Run,Run,true,,6167097,"Mon, 10/19/2020",1603134720,2020-10-19T23:12:00+0000,Mon,0.80,800,kilometers,km,2:40,160,2:40,160,false,,false,false,0,m,0,,https://www.strava.com/activities/4218294462,https://www.strava.com/activities/4218294462?utm_content=36052432&utm_medium=referral&utm_source=twitter,went for a 0.8 kilometer Run.,false,false,,0,false,false,false,false,only_me
4218280845,tempo 3,Run,Run,Run,false,,6167097,"Mon, 10/19/2020",1603134547,2020-10-19T23:09:07+0000,Mon,1.98,1983.43,kilometers,km,7:18,438,7:25,445,false,https://d3o5xota0a1fcr.cloudfront.net/v6/maps/LYSY6X7NH2LZJKJ2YYK3U6IJ6BDKPFXKE3AJRC2XYH3HXULLUO6O2ZAIMFEA3ZAHR6G2NGRUDLPMZFUQDJRINBZR4RFMTOUK,true,false,19,m,18.5043,,https://www.strava.com/activities/4218280845,https://www.strava.com/activities/4218280845?utm_content=36052432&utm_medium=referral&utm_source=twitter,went for a 1.9 kilometer Run.,false,false,,0,false,false,false,false,everyone
4218280847,tempo 2,Run,Run,Run,false,,6167097,"Mon, 10/19/2020",1603134012,2020-10-19T23:00:12+0000,Mon,1.98,1984.79,kilometers,km,7:22,442,7:31,451,false,https://d3o5xota0a1fcr.cloudfront.net/v6/maps/F5AFN33OKCXWKJMFWPJ77YJ6SEMFZW26OK32EBN7CSKI7QM6WYDCRXSG5JPCLS6BJWD5GOC6L2HDMCMUACKFYQED75JQEME4,true,false,18,m,17.9948,,https://www.strava.com/activities/4218280847,https://www.strava.com/activities/4218280847?utm_content=36052432&utm_medium=referral&utm_source=twitter,went for a 1.9 kilometer Run.,false,false,,0,false,false,false,false,everyone
4218284131,Tempo 1 ,Run,Run,Run,false,,6167097,"Mon, 10/19/2020",1603133527,2020-10-19T22:52:07+0000,Mon,2.00,2000,kilometers,km,7:20,440,7:20,440,false,,false,false,0,m,0,(Forgot to record),https://www.strava.com/activities/4218284131,https://www.strava.com/activities/4218284131?utm_content=36052432&utm_medium=referral&utm_source=twitter,went for a 2.0 kilometer Run.,false,false,,0,false,false,false,false,everyone
4218280842,warmup,Run,Run,Run,false,,6167097,"Mon, 10/19/2020",1603130938,2020-10-19T22:08:58+0000,Mon,3.21,3212.55,kilometers,km,14:06,846,14:27,867,false,https://d3o5xota0a1fcr.cloudfront.net/v6/maps/BOJ6ESOQ5YTYGTHTA3BIE3HBXCZ2YOWHGPYL6BGX3RJS5H3LEWF2OA3AHWQ62DQOFYWFI56XKAOHJGQOHZ4CS7VP5BLF7LOS,true,false,0,m,0,,https://www.strava.com/activities/4218280842,https://www.strava.com/activities/4218280842?utm_content=36052432&utm_medium=referral&utm_source=twitter,went for a 3.2 kilometer Run.,false,false,,0,false,false,false,false,everyone
4213818203,Ending off an easy week,Run,Run,Run,false,,6167097,"Sun, 10/18/2020",1603041062,2020-10-18T21:11:02+0000,Sun,11.50,11500.3,kilometers,km,49:43,2983,53:49,3229,false,https://d3o5xota0a1fcr.cloudfront.net/v6/maps/OPP4Z3WC6KWIHHVKNOSGWOH7MZE2O4ZAPQRVZJHMLKNNZ4726576DC3DUKTA4S4AKYK7X4XMWPVIF7UJP7AZGFXHD3MMJ2DZ,true,false,16,m,15.5048,legs were a little sore near the end ,https://www.strava.com/activities/4213818203,https://www.strava.com/activities/4213818203?utm_content=36052432&utm_medium=referral&utm_source=twitter,went for a 11.5 kilometer Run.,false,false,,0,false,false,false,false,everyone
4207314987,Long but not that long,Run,Run,Run,false,,6167097,"Sat, 10/17/2020",1602925820,2020-10-17T13:10:20+0000,Sat,17.28,17282,kilometers,km,1:17:58,4678,1:26:50,5210,false,https://d3o5xota0a1fcr.cloudfront.net/v6/maps/TQM4HX5AN7JZEVJ7ZSWGA5PUQ454V3MTYLNXPB7CDU2IR7LWDENHS6ID43T6TIVKXJ4KNOOYSUMJERUK4YT4IT5WQ4GCLQIL,true,false,62,m,62.2354,,https://www.strava.com/activities/4207314987,https://www.strava.com/activities/4207314987?utm_content=36052432&utm_medium=referral&utm_source=twitter,went for a 17.2 kilometer Run.,false,false,,0,false,false,false,false,everyone
4203954042,cooldown,Run,Run,Run,false,,6167097,"Fri, 10/16/2020",1602872475,2020-10-16T22:21:15+0000,Fri,5.52,5528.75,kilometers,km,27:30,1650,28:16,1696,false,https://d3o5xota0a1fcr.cloudfront.net/v6/maps/J5TGH6FWYJOKNVAUHX2CBQVOHMKQ7BUWOQ56XWUK2ZYLXFINJB3OK7NM2CB23XY53YZH2UVEWENXXVCYLKMSKL5VQW6ZWMTY,true,false,6,m,6.45,,https://www.strava.com/activities/4203954042,https://www.strava.com/activities/4203954042?utm_content=36052432&utm_medium=referral&utm_source=twitter,went for a 5.5 kilometer Run.,false,false,,0,false,false,false,false,everyone
4203867019,Afternoon Run,Run,Run,Run,false,,6167097,"Fri, 10/16/2020",1602869304,2020-10-16T21:28:24+0000,Fri,9.09,9097.32,kilometers,km,35:40,2140,45:33,2733,false,https://d3o5xota0a1fcr.cloudfront.net/v6/maps/XHFFK2SA7SJ43TN4GKJA77AQHIPCEAEL6C5DKJEJFJQMZE53TOEURMD7JY4U7FBOIGOGD4IHCIWLVUR44M7UM6PTB3MPT7FY,true,false,14,m,13.94,warmup + lots of dynamics + 20mins on trails,https://www.strava.com/activities/4203867019,https://www.strava.com/activities/4203867019?utm_content=36052432&utm_medium=referral&utm_source=twitter,went for a 9.0 kilometer Run.,false,false,,0,false,false,false,false,everyone
4196228179,Evening Run,Run,Run,Run,false,,6167097,"Wed, 10/14/2020",1602702261,2020-10-14T23:04:21+0000,Wed,10.02,10026.9,kilometers,km,44:58,2698,49:18,2958,false,https://d3o5xota0a1fcr.cloudfront.net/v6/maps/3Y5SI3G37MNI3GA2SWVOHDOM4VP7CKOH4RFQY5SQ3P6WBXH6FPNH2ECZSCLW7LCHNEQ4EGNMZIP372WIENNUUMW7END27OE4,true,false,16,m,15.6,"distance was a little off, should be 10.50km at 4:16/km",https://www.strava.com/activities/4196228179,https://www.strava.com/activities/4196228179?utm_content=36052432&utm_medium=referral&utm_source=twitter,went for a 10.0 kilometer Run.,false,false,,0,false,false,false,false,everyone
4191693783,Cooldown,Run,Run,Run,false,,6167097,"Tue, 10/13/2020",1602614973,2020-10-13T22:49:33+0000,Tue,4.36,4365.61,kilometers,km,22:13,1333,25:18,1518,false,https://d3o5xota0a1fcr.cloudfront.net/v6/maps/HDIHE2WWWVYPBW4BHHYDBWLXMRNU4HVYZZ2II4PWDZOZNRUT4GFY2NZSSIU75KFCGQL2DEWYUYVVWPQMKCAE4BMTT5NJJTWP,true,false,26,m,25.5129,The fog was absolutely sinister ,https://www.strava.com/activities/4191693783,https://www.strava.com/activities/4191693783?utm_content=36052432&utm_medium=referral&utm_source=twitter,went for a 4.3 kilometer Run.,false,false,,0,false,false,false,false,everyone
6381490721,Afternoon Run,Run,Run,Run,false,,7834038,"Mon, 12/13/2021",1639411592,2021-12-13T21:06:32+0000,Mon,10.28,10281.4,kilometers,km,1:01:05,3665,1:07:55,4075,false,https://d3o5xota0a1fcr.cloudfront.net/v6/maps/ETJOQXYPM6V4NRFR64VBN7SKBPT7PDT2CJJJVW3UGUN2XZ5Q62EEM3L3CESVYZXGFNCYTB6LKAKRFJYU37ID4WMGTTL3P4EF,true,false,39,m,38.9515,,https://www.strava.com/activities/6381490721,https://www.strava.com/activities/6381490721?utm_content=36052432&utm_medium=referral&utm_source=twitter,went for a 10.2 kilometer Run.,true,false,,,false,false,false,true,followers_only
6380160595,Afternoon Run,Run,Run,Run,false,,7834038,"Sat, 12/11/2021",1639238274,2021-12-11T20:57:54+0000,Sat,10.02,10020.6,kilometers,km,58:37,3517,59:55,3595,false,https://d3o5xota0a1fcr.cloudfront.net/v6/maps/EFJMIOQMA5MXAFHBCUXWCHW2BTV74JNK2BNOPDIGB5JDO5IMCK5EETLHHH6EBWSNQWC3JRI6C4IHX2PNPPY6OLOQMNGVF4YC,true,false,24,m,23.7726,,https://www.strava.com/activities/6380160595,https://www.strava.com/activities/6380160595?utm_content=36052432&utm_medium=referral&utm_source=twitter,went for a 10.0 kilometer Run.,true,false,,,false,false,false,true,followers_only
6380160455,Afternoon Run,Run,Run,Run,false,,7834038,"Wed, 12/8/2021",1638982668,2021-12-08T21:57:48+0000,Wed,10.00,10001.1,kilometers,km,57:49,3469,1:00:10,3610,false,https://d3o5xota0a1fcr.cloudfront.net/v6/maps/UU4P4FAQL7FGRCCBVHPYJ6VVLH6UJGG3H24ZWNYDCARGEK4UXFIAEWB3GUU772LUF7IRKDTMXJX7EWYXEOW6H5SRK7TNWU4F,true,false,25,m,24.8682,,https://www.strava.com/activities/6380160455,https://www.strava.com/activities/6380160455?utm_content=36052432&utm_medium=referral&utm_source=twitter,went for a 10.0 kilometer Run.,true,false,,,false,false,false,true,followers_only
6380160601,Afternoon Run,Run,Run,Run,false,,7834038,"Tue, 12/7/2021",1638885997,2021-12-07T19:06:37+0000,Tue,9.97,9976.37,kilometers,km,43:20,2600,46:24,2784,false,https://d3o5xota0a1fcr.cloudfront.net/v6/maps/ZZKLAGRDII4LW72QO6TWBKCFQ35CHU6RZSN3HHAEKX33ZNIPN4ABVCCKKY7U2M22VC6LC7ZCE2EJWHIVV6PQLCSI4WDHZOV3,true,false,26,m,25.6624,,https://www.strava.com/activities/6380160601,https://www.strava.com/activities/6380160601?utm_content=36052432&utm_medium=referral&utm_source=twitter,went for a 9.9 kilometer Run.,true,false,,,false,false,false,true,followers_only
6380160399,Afternoon Run,Run,Run,Run,false,,7834038,"Fri, 12/3/2021",1638548467,2021-12-03T21:21:07+0000,Fri,10.10,10108.2,kilometers,km,57:19,3439,59:53,3593,false,https://d3o5xota0a1fcr.cloudfront.net/v6/maps/4SAEEC7DYJUAQ5VKGWQ666ETGKAALS6AZBMKEFXJYCKI4ARERRIESRGW4T2S53SDIT23UBJUIVZMAYOZYN7JHXPO2AH74MXG,true,false,25,m,25.389,,https://www.strava.com/activities/6380160399,https://www.strava.com/activities/6380160399?utm_content=36052432&utm_medium=referral&utm_source=twitter,went for a 10.1 kilometer Run.,true,false,,,false,false,false,true,followers_only
6380160342,Afternoon Run,Run,Run,Run,false,,7834038,"Wed, 12/1/2021",1638371819,2021-12-01T20:16:59+0000,Wed,10.12,10128.2,kilometers,km,57:08,3428,1:02:05,3725,false,https://d3o5xota0a1fcr.cloudfront.net/v6/maps/46EAIEZUF7GCMW5FMF37XF3JQB5D4DY6MBFV4IKM3K7O6TSICXOIP5NG2LNEMARMWJTPXJTVPM2GV2SLPAKZF7WKU3XAYV32,true,false,47,m,46.7467,,https://www.strava.com/activities/6380160342,https://www.strava.com/activities/6380160342?utm_content=36052432&utm_medium=referral&utm_source=twitter,went for a 10.1 kilometer Run.,true,false,,,false,false,false,true,followers_only
6380160192,Afternoon Run,Run,Run,Run,false,,7834038,"Mon, 11/29/2021",1638201078,2021-11-29T20:51:18+0000,Mon,10.16,10159.7,kilometers,km,48:51,2931,51:17,3077,false,https://d3o5xota0a1fcr.cloudfront.net/v6/maps/7RINLYOKBXG3II3WL7FI7Y4G4NN4CIO76NZD5A6HNLWD5IZVUXSIJGGFPW7VX3RPT3BTT7ATH6T6I7WOOSQHGIIZBDM6NRFY,true,false,25,m,25.2071,,https://www.strava.com/activities/6380160192,https://www.strava.com/activities/6380160192?utm_content=36052432&utm_medium=referral&utm_source=twitter,went for a 10.1 kilometer Run.,true,false,,,false,false,false,true,followers_only
6380160151,Afternoon Run,Run,Run,Run,false,,7834038,"Fri, 11/26/2021",1637942741,2021-11-26T21:05:41+0000,Fri,10.06,10064.8,kilometers,km,52:00,3120,1:03:37,3817,false,https://d3o5xota0a1fcr.cloudfront.net/v6/maps/PQYVBAQRTX4Q647JEKEF3UEDW463QXL26B26ZBQHU73HF7D3PAMHQCL3B4A7UZWT45GAVCPLM6MO7D2F6D53IFP3VKAIRCUQ,true,false,25,m,24.669,,https://www.strava.com/activities/6380160151,https://www.strava.com/activities/6380160151?utm_content=36052432&utm_medium=referral&utm_source=twitter,went for a 10.0 kilometer Run.,true,false,,,false,false,false,true,followers_only
6380160081,Afternoon Run,Run,Run,Run,false,,7834038,"Wed, 11/24/2021",1637772302,2021-11-24T21:45:02+0000,Wed,10.02,10027.6,kilometers,km,56:37,3397,1:10:51,4251,false,https://d3o5xota0a1fcr.cloudfront.net/v6/maps/WA643MJWTKGIWZBDGRCZC2PITZVUV3HXBAIVTWLXL3TGCWPS5W5IIOM7MH3XY2ZMCQQKNQUJ5WE4XOTZ4EBKSCZSGM6ZBCAB,true,false,24,m,24.1647,,https://www.strava.com/activities/6380160081,https://www.strava.com/activities/6380160081?utm_content=36052432&utm_medium=referral&utm_source=twitter,went for a 10.0 kilometer Run.,true,false,,,false,false,false,true,followers_only
6380160019,Afternoon Run,Run,Run,Run,false,,7834038,"Mon, 11/22/2021",1637596598,2021-11-22T20:56:38+0000,Mon,9.31,9318.41,kilometers,km,56:25,3385,1:06:31,3991,false,https://d3o5xota0a1fcr.cloudfront.net/v6/maps/4WINJDFNZEHRSE34KTHKMABXEFVGPP5XSCTMDXBOAFEYIJIWSEMH6VCYA5ALIIBMTJLNRQ4Q3PKXYJDH4TNUTBZUSSZX4R3N,true,false,15,m,15.1387,,https://www.strava.com/activities/6380160019,https://www.strava.com/activities/6380160019?utm_content=36052432&utm_medium=referral&utm_source=twitter,went for a 9.3 kilometer Run.,true,false,,,false,false,false,true,followers_only
6380159817,Evening Run,Run,Run,Run,false,,7834038,"Fri, 11/19/2021",1637345387,2021-11-19T23:09:47+0000,Fri,0.00,4.88,kilometers,km,5s,5,9s,9,false,https://d3o5xota0a1fcr.cloudfront.net/v6/maps/JINUHVRMRGVOIWKPD57B6DONOBKR4SN3VTYTH2BGDBIEXVQCXEJH2DPSIPU2GKR4HUSH65IWYU5SAAG5SEQRSURU2FZN2OAR,true,false,0,m,0,,https://www.strava.com/activities/6380159817,https://www.strava.com/activities/6380159817?utm_content=36052432&utm_medium=referral&utm_source=twitter,went for a 0.0 kilometer Run.,true,false,,,false,false,false,true,followers_only
6281064202,Afternoon Run,Run,Run,Run,false,,7834038,"Fri, 11/19/2021",1637340219,2021-11-19T21:43:39+0000,Fri,2.29,2294.46,kilometers,km,13:19,799,14:50,890,false,https://d3o5xota0a1fcr.cloudfront.net/v6/maps/RGWWGARZXQHW64AEPB3IMZTXOI77OOSOEGWJXDBZ3NM7354KLFME5IJ4QRJWC3ICTPEMZTM7YL7L2HNZJ3BWZXXJRFSXR6ZK,true,false,19,m,18.9237,,https://www.strava.com/activities/6281064202,https://www.strava.com/activities/6281064202?utm_content=36052432&utm_medium=referral&utm_source=twitter,went for a 2.2 kilometer Run.,true,false,,,false,false,false,true,followers_only
6273184411,Afternoon Run,Run,Run,Run,false,,7834038,"Wed, 11/17/2021",1637163744,2021-11-17T20:42:24+0000,Wed,10.04,10043.2,kilometers,km,54:51,3291,57:51,3471,false,https://d3o5xota0a1fcr.cloudfront.net/v6/maps/UCSE3BSBCMNSZXT73Y3GEFCEHVWNZDBQ2FLEPCEKX4XHAOADEWRBJXDZ5O5IKBEBCYSZKUUKG2A3FILT2GZ672AEMWUTNF7G,true,false,25,m,24.9926,,https://www.strava.com/activities/6273184411,https://www.strava.com/activities/6273184411?utm_content=36052432&utm_medium=referral&utm_source=twitter,went for a 10.0 kilometer Run.,true,false,,,false,false,false,false,everyone
6273184465,Afternoon Run,Run,Run,Run,false,,7834038,"Fri, 11/12/2021",1636733391,2021-11-12T21:09:51+0000,Fri,10.07,10073.4,kilometers,km,51:51,3111,55:27,3327,false,https://d3o5xota0a1fcr.cloudfront.net/v6/maps/UNVT543VTGHLMC4CFJ73AT4TAW33EQXLDDM5VNMLJBFYYSYJHT2QXS5CODJJU6KTCKMQAO65CKYYM7ID3MWWKHDUYU3YGIZE,true,false,25,m,25.0287,,https://www.strava.com/activities/6273184465,https://www.strava.com/activities/6273184465?utm_content=36052432&utm_medium=referral&utm_source=twitter,went for a 10.0 kilometer Run.,true,false,,,false,false,false,false,everyone
6273184371,Afternoon Run,Run,Run,Run,false,,7834038,"Wed, 11/10/2021",1636557152,2021-11-10T20:12:32+0000,Wed,10.05,10057.4,kilometers,km,52:16,3136,54:31,3271,false,https://d3o5xota0a1fcr.cloudfront.net/v6/maps/Y7CZ4VZCFFDX4GEDPIUJXUXJQY7WZD73KJDN77FA7CX5JOWILUJQTSAWS7NQ5ONVPJXBTEVKQZGS66P6SHIYH5CEVSWCTGO3,true,false,47,m,47.4409,,https://www.strava.com/activities/6273184371,https://www.strava.com/activities/6273184371?utm_content=36052432&utm_medium=referral&utm_source=twitter,went for a 10.0 kilometer Run.,true,false,,,false,false,false,false,everyone
6273184331,Afternoon Run,Run,Run,Run,false,,7834038,"Mon, 11/8/2021",1636386024,2021-11-08T20:40:24+0000,Mon,10.17,10171.4,kilometers,km,56:07,3367,59:16,3556,false,https://d3o5xota0a1fcr.cloudfront.net/v6/maps/S327HYRIEDYP4OZ7BMRIRMZZ4K4BDKM52I6U5PVUMNDBEJ4LW3S3GVOEOZVEXRQT72ZIMJA4TGBNEPUOH5CRIUSZ53524AGE,true,false,25,m,25.3892,,https://www.strava.com/activities/6273184331,https://www.strava.com/activities/6273184331?utm_content=36052432&utm_medium=referral&utm_source=twitter,went for a 10.1 kilometer Run.,true,false,,,false,false,false,false,everyone
6273184253,Afternoon Run,Run,Run,Run,false,,7834038,"Wed, 11/3/2021",1635954859,2021-11-03T19:54:19+0000,Wed,7.73,7737.32,kilometers,km,38:41,2321,40:32,2432,false,https://d3o5xota0a1fcr.cloudfront.net/v6/maps/F356XX2DCLVR6AI3LER6AISPSVT2TDODXK4ABBORUJJD7M6GLWVH7T4EF42EHSJPOE7RKNZFF4EYIJ5Q3LZ3HMBGYC2V2UND,true,false,41,m,41.3711,,https://www.strava.com/activities/6273184253,https://www.strava.com/activities/6273184253?utm_content=36052432&utm_medium=referral&utm_source=twitter,went for a 7.7 kilometer Run.,true,false,,,false,false,false,false,everyone
6198794450,Afternoon Run,Run,Run,Run,false,,7834038,"Mon, 11/1/2021",1635783285,2021-11-01T20:14:45+0000,Mon,14.28,14287.1,kilometers,km,1:10:08,4208,1:13:48,4428,false,https://d3o5xota0a1fcr.cloudfront.net/v6/maps/VCVLZYSIN5MM5NLJGRNBJYQNJV4MO5ANGUMDPN42FIOWWFTKPFJ3LXEQHYJRAUYOATHHOJ2C2ZT4T3NZ2NMBBSHEEYT3R2RK,true,false,33,m,32.6505,,https://www.strava.com/activities/6198794450,https://www.strava.com/activities/6198794450?utm_content=36052432&utm_medium=referral&utm_source=twitter,went for a 14.2 kilometer Run.,true,false,,,false,false,false,false,everyone
6198794126,Afternoon Run,Run,Run,Run,false,,7834038,"Fri, 10/29/2021",1635526120,2021-10-29T20:48:40+0000,Fri,9.07,9071.56,kilometers,km,48:15,2895,51:22,3082,false,https://d3o5xota0a1fcr.cloudfront.net/v6/maps/NTH5FM5V4F72WLUCJPRD5NFKV4DH5WX63ZR23H6YOXFYPLZ7TPNRQAUC72755ZPGAMX5QNOB3CNFJBVNIXIHTAAM4DQZWC7J,true,false,49,m,49.3808,,https://www.strava.com/activities/6198794126,https://www.strava.com/activities/6198794126?utm_content=36052432&utm_medium=referral&utm_source=twitter,went for a 9.0 kilometer Run.,true,false,,,false,false,false,false,everyone
6198794015,Afternoon Run,Run,Run,Run,false,,7834038,"Wed, 10/27/2021",1635350975,2021-10-27T20:09:35+0000,Wed,9.53,9533.61,kilometers,km,50:21,3021,52:57,3177,false,https://d3o5xota0a1fcr.cloudfront.net/v6/maps/C4AGVFU6UNR34NO4LWIUUXZ4Y4UQCTWDFGLLR734LVXEVWRYPINPG5YGTI2S5TIWSE22CZ23VEUQMP3WLDFQDIW4H3U33KJE,true,false,53,m,53.3114,,https://www.strava.com/activities/6198794015,https://www.strava.com/activities/6198794015?utm_content=36052432&utm_medium=referral&utm_source=twitter,went for a 9.5 kilometer Run.,true,false,,,false,false,false,false,everyone
5326632143,warmup,Run,Run,Run,false,,7834038,"Wed, 5/19/2021",1621419379,2021-05-19T14:16:19+0000,Wed,3.42,3421.3,kilometers,km,15:31,931,17:10,1030,false,https://d3o5xota0a1fcr.cloudfront.net/v6/maps/JOK2LE6GTQRPLYU7QIHKGMEANXGWXDNSKKDQ6SHHVQUE2QUNWAFOKCEUWJ25P6W5WZQQFLQY2T37I6R5JOJ2TV236R7JPK6T,true,false,14,m,14.0214,,https://www.strava.com/activities/5326632143,https://www.strava.com/activities/5326632143?utm_content=36052432&utm_medium=referral&utm_source=twitter,went for a 3.4 kilometer Run.,true,false,,0,false,false,false,false,everyone
5319609323,Lunch Run,Run,Run,Run,false,,7834038,"Tue, 5/18/2021",1621338428,2021-05-18T15:47:08+0000,Tue,9.07,9070.7,kilometers,km,39:10,2350,40:47,2447,false,https://d3o5xota0a1fcr.cloudfront.net/v6/maps/WJ72DJKKBLMEREHFWIONHYPZGMW2V7VNKMFTTANEZLRX2KJYB2O5EJ2GJDEFL4HWCUZHQZ5T5WOAJLWSARNWW67ZLRIVTXHU,true,false,8,m,7.80625,,https://www.strava.com/activities/5319609323,https://www.strava.com/activities/5319609323?utm_content=36052432&utm_medium=referral&utm_source=twitter,went for a 9.0 kilometer Run.,true,false,,,false,false,false,false,everyone
5319609140,Evening Run,Run,Run,Run,false,,7834038,"Mon, 5/17/2021",1621281619,2021-05-18T00:00:19+0000,Mon,10.43,10431.9,kilometers,km,45:29,2729,46:57,2817,false,https://d3o5xota0a1fcr.cloudfront.net/v6/maps/KFMKTYU7DEN3ZBMSK57QHE5NDAROCTCYUF5UD66XMZ3MNYBJTT76PO52HUO4R2NNV24TYYTZZNCCHY2JLXTJZPNK7VLGIGBI,true,false,9,m,8.62183,,https://www.strava.com/activities/5319609140,https://www.strava.com/activities/5319609140?utm_content=36052432&utm_medium=referral&utm_source=twitter,went for a 10.4 kilometer Run.,true,false,,,false,false,false,false,everyone
5309981411,Afternoon Run,Run,Run,Run,false,,7834038,"Sun, 5/16/2021",1621174205,2021-05-16T18:10:05+0000,Sun,12.98,12988.4,kilometers,km,56:58,3418,59:00,3540,false,https://d3o5xota0a1fcr.cloudfront.net/v6/maps/GKJXZTSSLQNSFAJJSSIWKUXQ3TH2HWA43PDUSVPENRAA5NXYKCY3JIDO2KE6IXJMDUF3RJI2ROG6O4YTX5NIX2YHIMSZYBHR,true,false,14,m,14.4045,,https://www.strava.com/activities/5309981411,https://www.strava.com/activities/5309981411?utm_content=36052432&utm_medium=referral&utm_source=twitter,went for a 12.9 kilometer Run.,true,false,,0,false,false,false,false,everyone
5297822204,Afternoon Run,Run,Run,Run,false,,7834038,"Fri, 5/14/2021",1621010251,2021-05-14T20:37:31+0000,Fri,19.43,19437.1,kilometers,km,1:23:06,4986,1:26:57,5217,false,https://d3o5xota0a1fcr.cloudfront.net/v6/maps/2AZIL33HRKNDK7KT4A7VEFZXMORHMNTK6LX52TJWCETH7PNU24IJWX32UXWSZYMGXL6AIMJQNV36ULEQQQYZ2BHLGHSMHLIL,true,false,30,m,29.9795,,https://www.strava.com/activities/5297822204,https://www.strava.com/activities/5297822204?utm_content=36052432&utm_medium=referral&utm_source=twitter,went for a 19.4 kilometer Run.,true,false,,0,false,false,false,false,everyone
5297944199,Evening Run,Run,Run,Run,false,,7834038,"Thu, 5/13/2021",1620930600,2021-05-13T22:30:00+0000,Thu,10.50,10500,kilometers,km,45:09,2709,45:09,2709,false,,false,false,0,m,0,,https://www.strava.com/activities/5297944199,https://www.strava.com/activities/5297944199?utm_content=36052432&utm_medium=referral&utm_source=twitter,went for a 10.5 kilometer Run.,false,false,,0,false,false,false,false,everyone
5290249202,Evening Run,Run,Run,Run,false,,7834038,"Wed, 5/12/2021",1620849052,2021-05-12T23:50:52+0000,Wed,10.47,10475.9,kilometers,km,47:10,2830,48:57,2937,false,https://d3o5xota0a1fcr.cloudfront.net/v6/maps/IVZZZVPDWUR3WQRUM5KPXUB3PQ3KBVRZ4DYFVITUNQMHKJTQLQTP7DEYM6YAKXUSRLCTDSE66UZ25HRNVN2RKXOQMGENQP7S,true,false,7,m,7.05917,,https://www.strava.com/activities/5290249202,https://www.strava.com/activities/5290249202?utm_content=36052432&utm_medium=referral&utm_source=twitter,went for a 10.4 kilometer Run.,true,false,,0,false,false,false,false,everyone
5270033430,Lunch Run,Run,Run,Run,false,,7834038,"Sun, 5/9/2021",1620565144,2021-05-09T16:59:04+0000,Sun,11.37,11378.8,kilometers,km,48:56,2936,50:29,3029,false,https://d3o5xota0a1fcr.cloudfront.net/v6/maps/DHSRBMWSCPRR5XMZ3P6QHCEDSZ6CDQGZKI6QFDCFLXYAA2O5KHQTED2Q7KC6RYA27XBUKQBTBCOEGIYJ4RI4Z3DCDZETE6WM,true,false,8,m,7.98,,https://www.strava.com/activities/5270033430,https://www.strava.com/activities/5270033430?utm_content=36052432&utm_medium=referral&utm_source=twitter,went for a 11.3 kilometer Run.,true,false,,0,false,false,false,false,everyone
5268363031,Evening Run,Run,Run,Run,false,,7834038,"Sat, 5/8/2021",1620499844,2021-05-08T22:50:44+0000,Sat,10.53,10536.6,kilometers,km,45:38,2738,47:20,2840,false,https://d3o5xota0a1fcr.cloudfront.net/v6/maps/MHTHBGOSGKGLWWQ6DVQVHJR5RZFJXXB2ZRX4KNLQKCZJLP2TBJXK2LXES3XATMEVLVCEB444LETULIBXHAIWJ5HLQMWN5FFU,true,false,8,m,8.08714,,https://www.strava.com/activities/5268363031,https://www.strava.com/activities/5268363031?utm_content=36052432&utm_medium=referral&utm_source=twitter,went for a 10.5 kilometer Run.,true,false,,0,false,false,false,false,everyone
5263007385,Afternoon Run,Run,Run,Run,true,,7834038,"Fri, 5/7/2021",1620396984,2021-05-07T18:16:24+0000,Fri,0.66,664.5,kilometers,km,3:19,199,3:19,199,true,,false,false,0,m,0,,https://www.strava.com/activities/5263007385,https://www.strava.com/activities/5263007385?utm_content=36052432&utm_medium=referral&utm_source=twitter,went for a 0.6 kilometer Run.,true,false,,0,false,false,false,false,only_me
5263006404,Afternoon Run,Run,Run,Run,false,,7834038,"Fri, 5/7/2021",1620392824,2021-05-07T17:07:04+0000,Fri,11.98,11987.6,kilometers,km,52:27,3147,53:48,3228,false,https://d3o5xota0a1fcr.cloudfront.net/v6/maps/XLJMXM66NNAB6KNEYOIYRCM4Q5ZYD4NZNDIRXPXXVEHUCZPHS5HHMBRTPHRKU3IHH7QPZ2E6KTEUTI6IPDVEG6IF2DSNKVBV,true,false,23,m,23.0399,,https://www.strava.com/activities/5263006404,https://www.strava.com/activities/5263006404?utm_content=36052432&utm_medium=referral&utm_source=twitter,went for a 11.9 kilometer Run.,true,false,,0,false,false,false,false,everyone
5251127768,Evening Run,Run,Run,Run,false,,7834038,"Wed, 5/5/2021",1620242804,2021-05-05T23:26:44+0000,Wed,10.55,10555,kilometers,km,47:33,2853,52:41,3161,false,https://d3o5xota0a1fcr.cloudfront.net/v6/maps/JCMWJKKFGSJQ5MX7AUIUGTFNZVSU6BCXZVZEZ6CCRXAZ5Q6CF4FADKEIS746A4OHXWC5ZDICI66S4COF56FECWHOZV52ZLRO,true,false,8,m,8.04543,,https://www.strava.com/activities/5251127768,https://www.strava.com/activities/5251127768?utm_content=36052432&utm_medium=referral&utm_source=twitter,went for a 10.5 kilometer Run.,true,false,,0,false,false,false,false,everyone
5238412566,6 strides ,Run,Run,Run,false,,7834038,"Mon, 5/3/2021",1620076920,2021-05-04T01:22:00+0000,Mon,0.73,735.8,kilometers,km,1:58,118,8:23,503,false,https://d3o5xota0a1fcr.cloudfront.net/v6/maps/WSWICRPZPZNMRAX3DJ6LDD5AIY5PJV7G7R2LEGWDGZXQ55LWQ6HGSEHNDBWBVORCJMRGDDFNRMYEJZSGVEMONVHBSFK2QC66,true,false,0,m,0,,https://www.strava.com/activities/5238412566,https://www.strava.com/activities/5238412566?utm_content=36052432&utm_medium=referral&utm_source=twitter,went for a 0.7 kilometer Run.,true,false,,0,false,false,false,false,everyone
5238412611,Night jog,Run,Run,Run,false,,7834038,"Mon, 5/3/2021",1620074831,2021-05-04T00:47:11+0000,Mon,6.54,6543.9,kilometers,km,30:22,1822,30:42,1842,false,https://d3o5xota0a1fcr.cloudfront.net/v6/maps/SM3N3C6DMQU6V7SGDUL5TFJ5T56VK24KGF3J7GB3VOZOH3NVQMLWC6FNHCXZTITIFU7OG4AP2XOEA6ZECBCNXT6W2Y4SMC2K,true,false,4,m,3.85167,,https://www.strava.com/activities/5238412611,https://www.strava.com/activities/5238412611?utm_content=36052432&utm_medium=referral&utm_source=twitter,went for a 6.5 kilometer Run.,true,false,,0,false,false,false,false,everyone
5238412623,Afternoon Run,Run,Run,Run,false,,7834038,"Sun, 5/2/2021",1619964548,2021-05-02T18:09:08+0000,Sun,9.18,9187.2,kilometers,km,39:17,2357,45:01,2701,false,https://d3o5xota0a1fcr.cloudfront.net/v6/maps/TJTCG243HCPNSLETBLOFW6LEOVR75HCKGT3WEXV2PW6VWMOQUDC4DINYK34XCC7VOE4WN6FQQRXGVRENHCBRWJPRK6EB7I6D,true,false,8,m,7.85455,,https://www.strava.com/activities/5238412623,https://www.strava.com/activities/5238412623?utm_content=36052432&utm_medium=referral&utm_source=twitter,went for a 9.1 kilometer Run.,true,false,,0,false,false,false,false,everyone
5231885286,Afternoon Run,Run,Run,Run,false,,7834038,"Sat, 5/1/2021",1619881618,2021-05-01T19:06:58+0000,Sat,12.84,12840.9,kilometers,km,56:04,3364,57:52,3472,false,https://d3o5xota0a1fcr.cloudfront.net/v6/maps/FP445YQLV7QGMJG6NRVBGOJL4AZ5BG6OL5QF3245QX3JX4AL2O75Y6EI6DZQNPAF7SBCPFMQYHH6MRWVX2CEDZDWTE55QQ2P,true,false,7,m,7.14167,,https://www.strava.com/activities/5231885286,https://www.strava.com/activities/5231885286?utm_content=36052432&utm_medium=referral&utm_source=twitter,went for a 12.8 kilometer Run.,true,false,,0,false,false,false,false,everyone
5215629297,strides,Run,Run,Run,false,,7834038,"Thu, 4/29/2021",1619713781,2021-04-29T20:29:41+0000,Thu,0.68,685.4,kilometers,km,2:02,122,6:04,364,false,https://d3o5xota0a1fcr.cloudfront.net/v6/maps/7EUMHR2BQEYQ4NEH5YT3UGOA7YXX7X2GMIRYRFK72NRO23CXLBFR5YREQSZHL5RVHIDN3K3PTAEHERKFGY4DMWUTAF747QBP,true,false,0,m,0,,https://www.strava.com/activities/5215629297,https://www.strava.com/activities/5215629297?utm_content=36052432&utm_medium=referral&utm_source=twitter,went for a 0.6 kilometer Run.,true,false,,0,false,false,false,false,everyone
5215629390,Afternoon Run,Run,Run,Run,false,,7834038,"Thu, 4/29/2021",1619710582,2021-04-29T19:36:22+0000,Thu,10.57,10574.7,kilometers,km,44:51,2691,48:07,2887,false,https://d3o5xota0a1fcr.cloudfront.net/v6/maps/K5B2M5HPWE7JZRTY22KC56AIDY2CGYKGYTPZSM6K6KPMABC77KSWESC5DR5COO26C3L5YWXD5M2JD5QB7IG4SSWZEEQSEATZ,true,false,8,m,7.98103,,https://www.strava.com/activities/5215629390,https://www.strava.com/activities/5215629390?utm_content=36052432&utm_medium=referral&utm_source=twitter,went for a 10.5 kilometer Run.,true,false,,0,false,false,false,false,everyone
5198745725,Absolutely exhausted from exams,Run,Run,Run,false,,7834038,"Mon, 4/26/2021",1619463969,2021-04-26T23:06:09+0000,Mon,10.47,10475.5,kilometers,km,47:38,2858,50:53,3053,false,https://d3o5xota0a1fcr.cloudfront.net/v6/maps/2MBPZYVU5ZU5TAQH5LTOUPFV2UF3YHR6STEG6LLVK5UJJOLZG3UNHV3MPIWTQRAKMHYWBYHXF2PNOEHIIOCXIDBOU2QZAJYM,true,false,8,m,8.00535,,https://www.strava.com/activities/5198745725,https://www.strava.com/activities/5198745725?utm_content=36052432&utm_medium=referral&utm_source=twitter,went for a 10.4 kilometer Run.,true,false,,0,false,false,false,false,everyone
5187303441,Evening Run,Run,Run,Run,false,,7834035,"Sat, 4/24/2021",1619293561,2021-04-24T23:46:01+0000,Sat,9.51,9518.9,kilometers,km,42:56,2576,45:11,2711,false,https://d3o5xota0a1fcr.cloudfront.net/v6/maps/F6JB57YD3ZREYJTEKA6JQBHNWTW323BTL7KAK7JU46ZQRW5SFW2LTHCHFMEY2LJ273RYK2D5LEQRL42AOIRLF52ANCQ6QHSI,true,false,7,m,7.07875,,https://www.strava.com/activities/5187303441,https://www.strava.com/activities/5187303441?utm_content=36052432&utm_medium=referral&utm_source=twitter,went for a 9.5 kilometer Run.,true,false,,,false,false,false,false,everyone
3186435867,"2400m wu, 4 x 300m @95% effort",Run,Run,Run,false,,5568843,"Thu, 3/5/2020",1583434823,2020-03-06T00:00:23+0000,Thu,3.60,3600,kilometers,km,18:00,1080,18:00,1080,false,,false,false,0,m,0,"8 minutes rest. 40, 41, 42, 44. ",https://www.strava.com/activities/3186435867,https://www.strava.com/activities/3186435867?utm_content=36052432&utm_medium=referral&utm_source=twitter,went for a 3.6 kilometer Run.,false,false,,0,false,false,false,false,everyone
3186430528,"3200m wu, 5x1000m @3k+2, 1200m cd",Run,Run,Run,false,,5568843,"Mon, 3/2/2020",1583172299,2020-03-02T23:04:59+0000,Mon,9.40,9400,kilometers,km,47:00,2820,47:00,2820,false,,false,false,0,m,0,Averaged 3:20-3:25 per km. Still sick. ,https://www.strava.com/activities/3186430528,https://www.strava.com/activities/3186430528?utm_content=36052432&utm_medium=referral&utm_source=twitter,went for a 9.4 kilometer Run.,false,false,,0,false,false,false,false,everyone
3146495214,Afternoon Run,Run,Run,Run,false,,5568843,"Sun, 3/1/2020",1583078071,2020-03-01T20:54:31+0000,Sun,13.81,13813.5,kilometers,km,59:15,3555,1:00:39,3639,false,https://d3o5xota0a1fcr.cloudfront.net/v6/maps/2JZKE262C7PY4DQD3ZS5ZV4KFSI4GU6XDGRW2ZVP62U2SIBZ3RBEJDQZ5BDSXLAMYSJD4DBGFLA6G2MDUDQW4UHMXLRMPK7V,true,false,37,m,36.7786,,https://www.strava.com/activities/3146495214,https://www.strava.com/activities/3146495214?utm_content=36052432&utm_medium=referral&utm_source=twitter,went for a 13.8 kilometer Run.,false,false,,0,false,false,false,false,everyone
3142503613,"1000m jog, 6x100m hills",Run,Run,Run,false,,5568843,"Sat, 2/29/2020",1582980444,2020-02-29T17:47:24+0000,Sat,1.60,1600,kilometers,km,8:00,480,8:00,480,false,,false,false,0,m,0,,https://www.strava.com/activities/3142503613,https://www.strava.com/activities/3142503613?utm_content=36052432&utm_medium=referral&utm_source=twitter,went for a 1.6 kilometer Run.,false,false,,0,false,false,false,false,everyone
3142497974,Lunch Run,Run,Run,Run,false,,5568843,"Sat, 2/29/2020",1582975332,2020-02-29T16:22:12+0000,Sat,1.86,1867.11,kilometers,km,9:31,571,10:06,606,false,https://d3o5xota0a1fcr.cloudfront.net/v6/maps/VADEZQ7GMSKWO6ERZ7J755FLLMYNPSUXAP4B7DV5B46XZICPZM4MUAUCN45EQ7HRD6RYXSRZ62GBIAYLCEIDVU74UI5LJXXG,true,false,5,m,5.07143,,https://www.strava.com/activities/3142497974,https://www.strava.com/activities/3142497974?utm_content=36052432&utm_medium=referral&utm_source=twitter,went for a 1.8 kilometer Run.,false,false,,0,false,false,false,false,everyone
3142497901,Morning Run,Run,Run,Run,false,,5568843,"Sat, 2/29/2020",1582971468,2020-02-29T15:17:48+0000,Sat,5.06,5061.13,kilometers,km,19:51,1191,20:53,1253,false,https://d3o5xota0a1fcr.cloudfront.net/v6/maps/HXCFAXOB722BVIQ7UXTNWL7XJW64G4BY4X332S6KKXHY6QZLATE6ECLHJJO2EHCJY4QL7C4MOCMVNWDIEPRE7477XX7L6R5Y,true,false,15,m,14.5167,,https://www.strava.com/activities/3142497901,https://www.strava.com/activities/3142497901?utm_content=36052432&utm_medium=referral&utm_source=twitter,went for a 5.0 kilometer Run.,false,false,,0,false,false,false,false,everyone
3142497800,Morning Run,Run,Run,Run,false,,5568843,"Sat, 2/29/2020",1582970632,2020-02-29T15:03:52+0000,Sat,2.86,2867,kilometers,km,13:12,792,13:26,806,false,https://d3o5xota0a1fcr.cloudfront.net/v6/maps/Y2D44YZQFNEZKE6ZILIRVNKDYVO4BYS262AW3HHMC2VQ5GQRDHPECTUIFU6PNTEC2BMEKQG5FH4NMIRCGHB6HXMZVFTCE7PA,true,false,7,m,7.48571,,https://www.strava.com/activities/3142497800,https://www.strava.com/activities/3142497800?utm_content=36052432&utm_medium=referral&utm_source=twitter,went for a 2.8 kilometer Run.,false,false,,0,false,false,false,false,everyone
3126460460,Afternoon Run,Run,Run,Run,false,,5568843,"Sun, 2/23/2020",1582469542,2020-02-23T19:52:22+0000,Sun,6.51,6518.79,kilometers,km,31:05,1865,32:13,1933,false,https://d3o5xota0a1fcr.cloudfront.net/v6/maps/7WRQZ6TKVWG5YIDEJQWHCINPNGM2IMKPLSMLJ6UDEVUFZYT5H4JESUN3R6PCJDNE52WHGWQBTGLVTJE5RMBUHTDVLIHCNMD5,true,false,20,m,20.1625,,https://www.strava.com/activities/3126460460,https://www.strava.com/activities/3126460460?utm_content=36052432&utm_medium=referral&utm_source=twitter,went for a 6.5 kilometer Run.,false,false,,0,false,false,false,false,everyone
3126291009,"wu, 5x 3min @3k+2 pace w/ 3 min rest, cd",Run,Run,Run,false,,5568843,"Sat, 2/22/2020",1582366803,2020-02-22T15:20:03+0000,Sat,9.50,9500,kilometers,km,47:30,2850,47:30,2850,false,,false,false,0,m,0,"Ran outdoors. Felt really difficult. Average distance was 920-940m, average pace 3:15-3:20",https://www.strava.com/activities/3126291009,https://www.strava.com/activities/3126291009?utm_content=36052432&utm_medium=referral&utm_source=twitter,went for a 9.5 kilometer Run.,false,false,,0,false,false,false,false,everyone
3120320166,Evening Run,Run,Run,Run,false,,5568843,"Fri, 2/21/2020",1582308177,2020-02-21T23:02:57+0000,Fri,4.82,4820.43,kilometers,km,21:31,1291,24:14,1454,false,https://d3o5xota0a1fcr.cloudfront.net/v6/maps/QXUQLWT2Q2N6JK4YJ2QHZ7HAZK25GMD4Q7YR5LJHUUND7NW6AEJKQKIYVKMH2Y4G26NBK2VUF2AKB3X3T44B2VGHMETADZRN,true,false,5,m,5,,https://www.strava.com/activities/3120320166,https://www.strava.com/activities/3120320166?utm_content=36052432&utm_medium=referral&utm_source=twitter,went for a 4.8 kilometer Run.,false,false,,0,false,false,false,false,everyone
3120252951,Afternoon Run,Run,Run,Run,false,,5568843,"Fri, 2/21/2020",1582305878,2020-02-21T22:24:38+0000,Fri,5.04,5042.03,kilometers,km,23:05,1385,24:02,1442,false,https://d3o5xota0a1fcr.cloudfront.net/v6/maps/6UAORFTGHMNLSJLHXUXIY3IIOF6K4SV2UZW47P2Y7MSBV2GAZAHJEIBB3STJSLVRTY2BPZX4KSPJDFSBWLDQZKOSARAXU6RX,true,false,24,m,23.6268,,https://www.strava.com/activities/3120252951,https://www.strava.com/activities/3120252951?utm_content=36052432&utm_medium=referral&utm_source=twitter,went for a 5.0 kilometer Run.,false,false,,0,false,false,false,false,everyone
3119358145,"wu, 5x600m @1500 pace, cd",Run,Run,Run,false,,5568843,"Thu, 2/20/2020",1582225439,2020-02-21T00:03:59+0000,Thu,9.00,9000,kilometers,km,45:00,2700,45:00,2700,false,,false,false,0,m,0,"1:47, 1:47, 1:47, 1:48, 1:46",https://www.strava.com/activities/3119358145,https://www.strava.com/activities/3119358145?utm_content=36052432&utm_medium=referral&utm_source=twitter,went for a 9.0 kilometer Run.,false,false,,0,false,false,false,false,everyone
3115028066,Afternoon Run,Run,Run,Run,false,,5568843,"Wed, 2/19/2020",1582133894,2020-02-19T22:38:14+0000,Wed,7.94,7947.19,kilometers,km,37:16,2236,39:11,2351,false,https://d3o5xota0a1fcr.cloudfront.net/v6/maps/ZKDJFXOAINYKJAROQFZ5VRAXMBBTD554RPGINXDF6XCQR4QZH3USQEKITZS5QJPCJ5VGI4PIV7VIH7IC4RZOREE7MNWQ3464,true,false,34,m,34.1738,,https://www.strava.com/activities/3115028066,https://www.strava.com/activities/3115028066?utm_content=36052432&utm_medium=referral&utm_source=twitter,went for a 7.9 kilometer Run.,false,false,,0,false,false,false,false,everyone
3109166941,Afternoon Run,Run,Run,Run,false,,5568843,"Mon, 2/17/2020",1581959674,2020-02-17T22:14:34+0000,Mon,13.46,13460.5,kilometers,km,1:06:01,3961,1:13:12,4392,false,https://d3o5xota0a1fcr.cloudfront.net/v6/maps/ADJ5JYLFFNVQOFPWELU5HJO27BX74SOCVXGDHHD4GKFVLKM5YULW6MLKXIML36X7I24B7WVGJPYT6EVHQUYRUUOOQPVP3QAL,true,false,32,m,31.8185,,https://www.strava.com/activities/3109166941,https://www.strava.com/activities/3109166941?utm_content=36052432&utm_medium=referral&utm_source=twitter,went for a 13.4 kilometer Run.,false,false,,0,false,false,false,false,everyone
3106505204,Afternoon Run,Run,Run,Run,false,,5568843,"Sun, 2/16/2020",1581873942,2020-02-16T22:25:42+0000,Sun,6.46,6463.17,kilometers,km,32:36,1956,34:30,2070,false,https://d3o5xota0a1fcr.cloudfront.net/v6/maps/73G6ZJ75XXMKWRHANAFB34XICWEQR4PAJBWDEUENY3G4L3DVVUWY2J6TX4DBRDO3JWRQSTCDASFHUO5VJ2DJSDCUGI6JT2T6,true,false,22,m,22.1827,,https://www.strava.com/activities/3106505204,https://www.strava.com/activities/3106505204?utm_content=36052432&utm_medium=referral&utm_source=twitter,went for a 6.4 kilometer Run.,false,false,,0,false,false,false,false,everyone
3103561953,warmup,Run,Run,Run,false,,5568843,"Sat, 2/15/2020",1581803977,2020-02-16T02:59:37+0000,Sat,3.00,3000,kilometers,km,15:00,900,15:00,900,false,,false,false,0,m,0,,https://www.strava.com/activities/3103561953,https://www.strava.com/activities/3103561953?utm_content=36052432&utm_medium=referral&utm_source=twitter,went for a 3.0 kilometer Run.,false,false,,0,false,false,false,false,everyone
3103561414,Raven’s Last Chance Meet,Run,Run,Run,false,,5568843,"Sat, 2/15/2020",1581772557,2020-02-15T18:15:57+0000,Sat,1.50,1500,kilometers,km,4:24,264,4:24,264,false,,false,false,0,m,0,Felt Awesome. Definitely need to keep consistent with the mileage.,https://www.strava.com/activities/3103561414,https://www.strava.com/activities/3103561414?utm_content=36052432&utm_medium=referral&utm_source=twitter,went for a 1.5 kilometer Run.,false,false,,1,false,false,false,false,everyone
3103560275,"3200m wu, 5x500m @1500 pace, 2400m cd",Run,Run,Run,false,,5568843,"Thu, 2/13/2020",1581621342,2020-02-14T00:15:42+0000,Thu,8.10,8100,kilometers,km,40:30,2430,40:30,2430,false,,false,false,0,m,0,"1:21, 1;24, 1:26, 1:26, 1:26",https://www.strava.com/activities/3103560275,https://www.strava.com/activities/3103560275?utm_content=36052432&utm_medium=referral&utm_source=twitter,went for a 8.1 kilometer Run.,false,false,,0,false,false,false,false,everyone
3094925549,Afternoon Run,Run,Run,Run,false,,5568843,"Wed, 2/12/2020",1581528498,2020-02-12T22:28:18+0000,Wed,6.81,6813.38,kilometers,km,31:25,1885,33:16,1996,false,https://d3o5xota0a1fcr.cloudfront.net/v6/maps/2ZKMLWEKHLQXU6H3ALAAL2VURQMFGBNYR7RGGRXCRZFENRCEKWSJK6MG7BWZ6R4LLS4ZFDXRYKNTTBJGF7YYSWT33SVUHYY4,true,false,23,m,22.9304,,https://www.strava.com/activities/3094925549,https://www.strava.com/activities/3094925549?utm_content=36052432&utm_medium=referral&utm_source=twitter,went for a 6.8 kilometer Run.,false,false,,0,false,false,false,false,everyone
3092026173,Afternoon Run,Run,Run,Run,false,,5568843,"Tue, 2/11/2020",1581441464,2020-02-11T22:17:44+0000,Tue,7.89,7892.85,kilometers,km,36:13,2173,38:12,2292,false,https://d3o5xota0a1fcr.cloudfront.net/v6/maps/SWWVQZYGDTLR7T5RLEOANG5NVZI2KGQQXSFVNW3OXMVUY5XEKK6VURZ5UZY47M7L3JZGAHPG5JWL34T7YK757QVWWP3ASDXZ,true,false,32,m,32.0232,,https://www.strava.com/activities/3092026173,https://www.strava.com/activities/3092026173?utm_content=36052432&utm_medium=referral&utm_source=twitter,went for a 7.8 kilometer Run.,false,false,,0,false,false,false,false,everyone
4382143265,cooldown,Run,Run,Run,false,,7198778,"Mon, 11/23/2020",1606159574,2020-11-24T00:26:14+0000,Mon,2.10,2099.3,kilometers,km,11:46,706,12:51,771,false,https://d3o5xota0a1fcr.cloudfront.net/v6/maps/MYZYJD4DKODICWCXLWBTTT56T5ZSJ7UZQ62VKF543FBQ4COD4T3OUVPRWPSLDYE7N7G6CTOJGOSZ7NDQN5DTH7ABQ6QQCOFW,true,false,11,m,11.4187,,https://www.strava.com/activities/4382143265,https://www.strava.com/activities/4382143265?utm_content=36052432&utm_medium=referral&utm_source=twitter,went for a 2.1 kilometer Run.,true,false,,0,false,false,false,false,everyone
4382143274,ladder workout,Run,Run,Run,false,,7198778,"Mon, 11/23/2020",1606157427,2020-11-23T23:50:27+0000,Mon,6.86,6862.2,kilometers,km,25:44,1544,25:44,1544,false,https://d3o5xota0a1fcr.cloudfront.net/v6/maps/ZQQDJYDQSO7F7BGPJWTU35X7I7PQZGQ3TTZOQSEBL6EDPTLS4SJRWTA54I6CDPXOIQ4XZGLBZWONVMIOY2KARIIURQAVGKEG,true,false,49,m,48.8108,"325m, 650m, 1000m, 1325m, 1000m, 650m, 325m with 150m/300m jog recovery",https://www.strava.com/activities/4382143274,https://www.strava.com/activities/4382143274?utm_content=36052432&utm_medium=referral&utm_source=twitter,went for a 6.8 kilometer Run.,true,false,,0,false,false,false,false,everyone
4382157083,warmup,Run,Run,Run,false,,7198778,"Mon, 11/23/2020",1606155660,2020-11-23T23:21:00+0000,Mon,1.60,1600,kilometers,km,8:30,510,8:30,510,false,,false,false,0,m,0,,https://www.strava.com/activities/4382157083,https://www.strava.com/activities/4382157083?utm_content=36052432&utm_medium=referral&utm_source=twitter,went for a 1.6 kilometer Run.,false,false,,,false,false,false,false,everyone
4377799819,Afternoon Run,Run,Run,Run,false,,7198778,"Sun, 11/22/2020",1606062807,2020-11-22T21:33:27+0000,Sun,10.18,10188.4,kilometers,km,45:14,2714,46:45,2805,false,https://d3o5xota0a1fcr.cloudfront.net/v6/maps/TKGLNS2ZOTBTO6OLMBWAZRUGHML2WRXU4BPKGAL7FKRVQBLOOJWV2IWYRS7QEMTKUIZJXED6QFQO3IODNDEQY7BO6YXWEN33,true,false,11,m,10.5102,"Cold, dark & snowy",https://www.strava.com/activities/4377799819,https://www.strava.com/activities/4377799819?utm_content=36052432&utm_medium=referral&utm_source=twitter,went for a 10.1 kilometer Run.,true,false,,0,false,false,false,false,everyone
4370592284,Long Run,Run,Run,Run,false,,7198778,"Sat, 11/21/2020",1605949660,2020-11-21T14:07:40+0000,Sat,18.05,18054.9,kilometers,km,1:12:36,4356,1:15:32,4532,false,https://d3o5xota0a1fcr.cloudfront.net/v6/maps/CJHIMH5XY72FRM65XL4R6NU244CZYGA4RDF72TGYAWND6U6YED3SL6ZPAESO22AIDGF65RHGDMYDWCPWQFMYTOSRS7E7FXOW,true,false,57,m,57.2472,,https://www.strava.com/activities/4370592284,https://www.strava.com/activities/4370592284?utm_content=36052432&utm_medium=referral&utm_source=twitter,went for a 18.0 kilometer Run.,true,false,,2,false,false,false,false,everyone
4362237628,45 min easy,Run,Run,Run,false,,7198778,"Thu, 11/19/2020",1605804286,2020-11-19T21:44:46+0000,Thu,10.12,10122,kilometers,km,45:22,2722,49:11,2951,false,https://d3o5xota0a1fcr.cloudfront.net/v6/maps/ZWKRFWC7NH3TMTKWJASWZ6K4TY6NOFULLHJCQ7BAY5YJPTHJXSTYJO6KGSTHTQ7AWGIL4UNHR7XXUMTIQDWKBTRQODGAAE3V,true,false,7,m,7.06964,,https://www.strava.com/activities/4362237628,https://www.strava.com/activities/4362237628?utm_content=36052432&utm_medium=referral&utm_source=twitter,went for a 10.1 kilometer Run.,true,false,,0,false,false,false,false,everyone
4362222329,cooldown,Run,Run,Run,false,,7198778,"Wed, 11/18/2020",1605727986,2020-11-19T00:33:06+0000,Wed,1.97,1976.9,kilometers,km,9:06,546,9:06,546,false,https://d3o5xota0a1fcr.cloudfront.net/v6/maps/VLE33SZKEDV4UYMPXRH7CMATDBJ7AEHTZZVKER3JXUR5QOQSPOFGRXOG3JMIYM47MZWZV3UFTP6433YECL2ZQN5MI4ISK7RB,true,false,12,m,11.8472,,https://www.strava.com/activities/4362222329,https://www.strava.com/activities/4362222329?utm_content=36052432&utm_medium=referral&utm_source=twitter,went for a 1.9 kilometer Run.,true,false,,0,false,false,false,false,everyone
4362222698,"7x 1km @tempo, 45s rest ",Run,Run,Run,false,,7198778,"Wed, 11/18/2020",1605725718,2020-11-18T23:55:18+0000,Wed,7.07,7078.6,kilometers,km,25:10,1510,29:55,1795,false,https://d3o5xota0a1fcr.cloudfront.net/v6/maps/EROLBZR6RXOJQDDNNSJR3GRM3QABTEGZ64CVPQDEHXGJ75OFVIMMVQUV7VCZWWY3NRMHDAOY2JOJ53FAKL7Z77K7DBKDLBVD,true,false,53,m,52.9641,,https://www.strava.com/activities/4362222698,https://www.strava.com/activities/4362222698?utm_content=36052432&utm_medium=referral&utm_source=twitter,went for a 7.0 kilometer Run.,true,false,,0,false,false,false,false,everyone
4362222244,warmup,Run,Run,Run,false,,7198778,"Wed, 11/18/2020",1605723529,2020-11-18T23:18:49+0000,Wed,1.69,1689,kilometers,km,8:16,496,8:16,496,false,https://d3o5xota0a1fcr.cloudfront.net/v6/maps/PXMUY66WHVP5Y2I2BFCIDDVE6LT443ZXV55D35WBUDY5G5VG2E2LXDCAUGVXGP7JGZJGLTUKLYBW5DLRSC56SWCV65QISYUE,true,false,4,m,4.19375,,https://www.strava.com/activities/4362222244,https://www.strava.com/activities/4362222244?utm_content=36052432&utm_medium=referral&utm_source=twitter,went for a 1.6 kilometer Run.,true,false,,0,false,false,false,false,everyone
4348610847,3 X’s on the field,Run,Run,Run,false,,7198778,"Mon, 11/16/2020",1605557850,2020-11-17T01:17:30+0000,Mon,0.80,800,kilometers,km,2:48,168,2:48,168,false,,false,false,0,m,0,,https://www.strava.com/activities/4348610847,https://www.strava.com/activities/4348610847?utm_content=36052432&utm_medium=referral&utm_source=twitter,went for a 0.8 kilometer Run.,false,false,,0,false,false,false,false,everyone
4348603696,Recovery ,Run,Run,Run,false,,7198778,"Mon, 11/16/2020",1605550369,2020-11-16T23:12:49+0000,Mon,11.23,11236.5,kilometers,km,49:36,2976,49:44,2984,false,https://d3o5xota0a1fcr.cloudfront.net/v6/maps/7HGGVAO3Z6UVQUG7NW7CPQOGYM3AGXSVFNXVR5YP56ITQXOQWUNHP4H5XDJXVARIB5BAODB4KLXCO23E7RICCCRIV6UB3T3E,true,false,40,m,39.7756,,https://www.strava.com/activities/4348603696,https://www.strava.com/activities/4348603696?utm_content=36052432&utm_medium=referral&utm_source=twitter,went for a 11.2 kilometer Run.,true,false,,0,false,false,false,false,everyone
4343706892,cooldown ,Run,Run,Run,false,,7198778,"Sun, 11/15/2020",1605451305,2020-11-15T19:41:45+0000,Sun,1.67,1674.3,kilometers,km,8:50,530,19:59,1199,false,https://d3o5xota0a1fcr.cloudfront.net/v6/maps/JZWNGCBPKBRNJCICYDQXA6HOAF54BKI6S7Q2RJVHLQAUQIORSGA2G2JHEACVGGBY4BL6IBZJB43WPGMRVTPHS23VC3VOIWT3,true,false,7,m,6.57895,,https://www.strava.com/activities/4343706892,https://www.strava.com/activities/4343706892?utm_content=36052432&utm_medium=referral&utm_source=twitter,went for a 1.6 kilometer Run.,true,false,,0,false,false,false,false,everyone
4343706942,AO’s,Run,Run,Run,false,,7198778,"Sun, 11/15/2020",1605449614,2020-11-15T19:13:34+0000,Sun,5.23,5230.1,kilometers,km,21:51,1311,24:30,1470,false,https://d3o5xota0a1fcr.cloudfront.net/v6/maps/I5MGBBEWJP42VURLEPIDF3EJ3IK5WIMHE4WO322FABCLZ4F63JA5HFIFLT2QAI2LTG662JFD2TN6AO2UBWGP6LUXZFSLT3WQ,true,false,66,m,66.0343,"6km, 3:40/km",https://www.strava.com/activities/4343706942,https://www.strava.com/activities/4343706942?utm_content=36052432&utm_medium=referral&utm_source=twitter,went for a 5.2 kilometer Run.,true,false,,1,false,false,false,false,everyone
4343706831,warmup,Run,Run,Run,false,,7198778,"Sun, 11/15/2020",1605447135,2020-11-15T18:32:15+0000,Sun,2.77,2774.8,kilometers,km,13:10,790,19:29,1169,false,https://d3o5xota0a1fcr.cloudfront.net/v6/maps/XRRLMZXT5P4QGIAURRJADORCEZTABBZKPYM4MHKZQLONEE6GNSVLAWFZHMVQCW5GZJL6NYJCCZYHP5E7GXS7RIMZWDSIUZY3,true,false,12,m,12.3243,,https://www.strava.com/activities/4343706831,https://www.strava.com/activities/4343706831?utm_content=36052432&utm_medium=referral&utm_source=twitter,went for a 2.7 kilometer Run.,true,false,,0,false,false,false,false,everyone
4338828941,4km easy + some strides + cooldown,Run,Run,Run,false,,7198778,"Sat, 11/14/2020",1605372733,2020-11-14T21:52:13+0000,Sat,7.40,7403.8,kilometers,km,33:21,2001,40:00,2400,false,https://d3o5xota0a1fcr.cloudfront.net/v6/maps/QKLCBWJIFTE6IAH6VDZUU3WW5ERUHUT7SXY4W75LA3SZEA3X2VAJGQCXTNYLX7DX2DWOC6EOMQV7MDL66PKE4NWFRJPHVGC4,true,false,4,m,3.89167,,https://www.strava.com/activities/4338828941,https://www.strava.com/activities/4338828941?utm_content=36052432&utm_medium=referral&utm_source=twitter,went for a 7.4 kilometer Run.,true,false,,0,false,false,false,false,everyone
4328645457,Progression Run ,Run,Run,Run,false,,7198778,"Thu, 11/12/2020",1605188722,2020-11-12T18:45:22+0000,Thu,11.98,11988.5,kilometers,km,47:08,2828,49:04,2944,false,https://d3o5xota0a1fcr.cloudfront.net/v6/maps/LAPLRGRPUM6Y57DFQUSD2F3PKRXOVRRSCPNSTHP7YXP7ZD34XZSF6SIJRB3NAJAFYEJDIDQXJHB7U2KUJUETJWVEY5EEVCW2,true,false,7,m,7.07385,felt good. Paced by my brother on his bike. Strava still managed to mess up my splits despite good GPS data :/,https://www.strava.com/activities/4328645457,https://www.strava.com/activities/4328645457?utm_content=36052432&utm_medium=referral&utm_source=twitter,went for a 11.9 kilometer Run.,true,false,,0,false,false,false,false,everyone
4325348552,"wu, 4x (2x200m + 1km), cd ",Run,Run,Run,false,,7198778,"Wed, 11/11/2020",1605128072,2020-11-12T01:54:32+0000,Wed,12.00,12000,kilometers,km,51:46,3106,51:46,3106,false,,false,false,0,m,0,200’s @1500 pace. 1k’s @ tempo. 200 jog recovery. ,https://www.strava.com/activities/4325348552,https://www.strava.com/activities/4325348552?utm_content=36052432&utm_medium=referral&utm_source=twitter,went for a 12.0 kilometer Run.,false,false,,0,false,false,false,false,everyone
4315407045,warmup + 10x400m @3k+2 + cooldown,Run,Run,Run,false,,7198778,"Mon, 11/9/2020",1604953667,2020-11-10T01:27:47+0000,Mon,9.00,9000,kilometers,km,37:25,2245,37:25,2245,false,,false,false,0,m,0,1 min rest. Mostly 78-80 seconds.,https://www.strava.com/activities/4315407045,https://www.strava.com/activities/4315407045?utm_content=36052432&utm_medium=referral&utm_source=twitter,went for a 9.0 kilometer Run.,false,false,,0,false,false,false,false,everyone
4310603374,Afternoon Run,Run,Run,Run,false,,7198778,"Sun, 11/8/2020",1604854721,2020-11-08T21:58:41+0000,Sun,10.03,10033.8,kilometers,km,46:16,2776,51:35,3095,false,https://d3o5xota0a1fcr.cloudfront.net/v6/maps/RZTAJYR3MSI5WNDPFE2YFEBZIFCSDQ2NWKSZC4DYGHYV6BFQINOCRJXVVPC7BEFFVEN3UXDRIQITGZ3LF6H262ZHSI2G4TL4,true,false,8,m,8.06002,,https://www.strava.com/activities/4310603374,https://www.strava.com/activities/4310603374?utm_content=36052432&utm_medium=referral&utm_source=twitter,went for a 10.0 kilometer Run.,true,false,,,false,false,false,false,everyone
4302963352,cooldown,Run,Run,Run,false,,7198778,"Sat, 11/7/2020",1604744885,2020-11-07T15:28:05+0000,Sat,2.57,2578.9,kilometers,km,13:46,826,13:46,826,false,https://d3o5xota0a1fcr.cloudfront.net/v6/maps/OJGQXK4OOFX4HKYTZNEN2DIIBYNQHYGZYSCG57UMCVYWQVEPKQQ64IFTG56ZA4YPBVGRPGZY3SWGNFFSHMYZFZYMMCA7YIDL,true,false,18,m,18.4427,,https://www.strava.com/activities/4302963352,https://www.strava.com/activities/4302963352?utm_content=36052432&utm_medium=referral&utm_source=twitter,went for a 2.5 kilometer Run.,true,false,,0,false,false,false,false,everyone
3382285809,cooldown + 6 strides ,Run,Run,Run,false,,5568843,"Fri, 5/1/2020",1588360075,2020-05-01T23:07:55+0000,Fri,1.17,1169.97,kilometers,km,4:39,279,9:32,572,false,https://d3o5xota0a1fcr.cloudfront.net/v6/maps/TCGGLZSAP7WANCV7TOOM6I7ZVAYWKYHAXDDUG7ACMOM7THCHSRGVXXVOFJ726YLTD3VEX4RWDYNQRVSLP655AIYLQGSI2M7X,true,false,8,m,8.39429,,https://www.strava.com/activities/3382285809,https://www.strava.com/activities/3382285809?utm_content=36052432&utm_medium=referral&utm_source=twitter,went for a 1.1 kilometer Run.,false,false,,0,false,false,false,false,everyone
3382285911,Evening Run,Run,Run,Run,false,,5568843,"Fri, 5/1/2020",1588357113,2020-05-01T22:18:33+0000,Fri,10.48,10481.8,kilometers,km,45:31,2731,49:17,2957,false,https://d3o5xota0a1fcr.cloudfront.net/v6/maps/P7XF6BE2D3N5L3IF6NWIO7FVYPKO5ZIX5QNX64F2UYW24IUJ3RZHLE6J6K7ZLDUU5JKIKTSZYPTVCVN5U7CJBWSFHYWO3U6Z,true,false,18,m,17.89,,https://www.strava.com/activities/3382285911,https://www.strava.com/activities/3382285911?utm_content=36052432&utm_medium=referral&utm_source=twitter,went for a 10.4 kilometer Run.,false,false,,0,false,false,true,false,everyone
3377424567,Evening Run,Run,Run,Run,false,,5568843,"Thu, 4/30/2020",1588272653,2020-04-30T22:50:53+0000,Thu,8.24,8241.79,kilometers,km,37:57,2277,41:07,2467,false,https://d3o5xota0a1fcr.cloudfront.net/v6/maps/6XEHD2RSORAWI555T7AILTXQ6GNSF5ISZW5EP3WSUZMQ3ID6TK77LRJVV7XUITM4U3NIGI32DZ3PN72U6J4QZJJMLYJ54HFH,true,false,19,m,19.3077,,https://www.strava.com/activities/3377424567,https://www.strava.com/activities/3377424567?utm_content=36052432&utm_medium=referral&utm_source=twitter,went for a 8.2 kilometer Run.,false,false,,0,false,false,true,false,everyone
3373049903,Afternoon Run,Run,Run,Run,false,,5568843,"Wed, 4/29/2020",1588183065,2020-04-29T21:57:45+0000,Wed,10.55,10557.6,kilometers,km,49:16,2956,1:01:02,3662,false,https://d3o5xota0a1fcr.cloudfront.net/v6/maps/ZIHEDP4O2WH4ZCECAUWGV47F4NSNGD5LOMLHRCQJSQ374NHPJOIDOT6I2FZROG267NAQEMHQTFXCPAYX54E3UCQUMYMBLHF3,true,false,18,m,17.8619,,https://www.strava.com/activities/3373049903,https://www.strava.com/activities/3373049903?utm_content=36052432&utm_medium=referral&utm_source=twitter,went for a 10.5 kilometer Run.,false,false,,0,false,false,false,false,everyone
3368049499,Afternoon Run,Run,Run,Run,false,,5568843,"Tue, 4/28/2020",1588092837,2020-04-28T20:53:57+0000,Tue,10.54,10539.1,kilometers,km,49:05,2945,50:12,3012,false,https://d3o5xota0a1fcr.cloudfront.net/v6/maps/HQI7DA72DNANGHEGOXSN4NMGTQQNKDZFSHUW6GYATW622ZA5NA4K72DSCQ2UEP6YQNDT43NIIRB5Z2TKUCHI4UP2RHHKBJED,true,false,18,m,17.9571,,https://www.strava.com/activities/3368049499,https://www.strava.com/activities/3368049499?utm_content=36052432&utm_medium=referral&utm_source=twitter,went for a 10.5 kilometer Run.,false,false,,0,false,false,true,false,everyone
3359244217,Sunday Long Run,Run,Run,Run,false,,5568843,"Sun, 4/26/2020",1587927405,2020-04-26T22:56:45+0000,Sun,17.12,17124.1,kilometers,km,1:17:41,4661,1:19:06,4746,false,https://d3o5xota0a1fcr.cloudfront.net/v6/maps/MC4RKVCNL2F34NPU3FJMBPHBAJM3IB4CRAT54V4FZJW762UVYY2T4HT5LPWLYYT7RG3XBEEIXBYX6EB5ZYS42NNNK6FENOF5,true,false,36,m,35.5619,,https://www.strava.com/activities/3359244217,https://www.strava.com/activities/3359244217?utm_content=36052432&utm_medium=referral&utm_source=twitter,went for a 17.1 kilometer Run.,false,false,,0,false,false,false,false,everyone
3353421320,10km progression run + cooldown,Run,Run,Run,false,,5568843,"Sat, 4/25/2020",1587838983,2020-04-25T22:23:03+0000,Sat,11.03,11035.6,kilometers,km,47:29,2849,49:47,2987,false,https://d3o5xota0a1fcr.cloudfront.net/v6/maps/UK7PII24UVFXENNAE62YIXDB47P64TRY7UUXW3RQXZQWEKCRBJNLBOF4FTKX7UNC2MTAIZ3LHVG7EDJVWE3T257RLNV2HHME,true,false,18,m,18.169,,https://www.strava.com/activities/3353421320,https://www.strava.com/activities/3353421320?utm_content=36052432&utm_medium=referral&utm_source=twitter,went for a 11.0 kilometer Run.,false,false,,0,false,false,true,false,everyone
3347992607,Evening Run,Run,Run,Run,false,,5568843,"Fri, 4/24/2020",1587751923,2020-04-24T22:12:03+0000,Fri,7.43,7433.48,kilometers,km,34:24,2064,35:01,2101,false,https://d3o5xota0a1fcr.cloudfront.net/v6/maps/5CXMZSD3V37LFAGQFZIZMDBEL2JINN2TT4KWP6MNVONCYRVS4HSHJY6RNDVNUTSQU6FWJKS5XEANXCYLETIIUX6JTZQJJPCN,true,false,19,m,19.1286,,https://www.strava.com/activities/3347992607,https://www.strava.com/activities/3347992607?utm_content=36052432&utm_medium=referral&utm_source=twitter,went for a 7.4 kilometer Run.,false,false,,0,false,false,true,false,everyone
3343462997,Afternoon Run,Run,Run,Run,false,,5568843,"Thu, 4/23/2020",1587662553,2020-04-23T21:22:33+0000,Thu,13.74,13748.1,kilometers,km,1:04:38,3878,1:06:02,3962,false,https://d3o5xota0a1fcr.cloudfront.net/v6/maps/QRRMCILZXSESTNJVLP2HWJRYJ3MG4Z62XYOSRXEOI6UU6QMDVPISRLYA4VALEDYRJXYRIL52JZRHM5OHWIJZG7TEGPI7MT5C,true,false,20,m,19.5119,,https://www.strava.com/activities/3343462997,https://www.strava.com/activities/3343462997?utm_content=36052432&utm_medium=referral&utm_source=twitter,went for a 13.7 kilometer Run.,false,false,,0,false,false,false,false,everyone
3338656912,Easy Run,Run,Run,Run,false,,5568843,"Wed, 4/22/2020",1587581213,2020-04-22T22:46:53+0000,Wed,10.44,10447.6,kilometers,km,52:31,3151,57:07,3427,false,https://d3o5xota0a1fcr.cloudfront.net/v6/maps/NT4VMMIYL4IMF253F726GPGYSBU6HEZOGODIXI3EHCUYIMLSZLQS442UMNLIGVZFTHZKZ3L3MHDSOUM6ZMAFKJE7GUURVY3P,true,false,18,m,17.9762,Had some pain after about the 3rd km and decided to pull the pace way back ,https://www.strava.com/activities/3338656912,https://www.strava.com/activities/3338656912?utm_content=36052432&utm_medium=referral&utm_source=twitter,went for a 10.4 kilometer Run.,false,false,,0,false,false,true,false,everyone
3328750276,Evening Run,Run,Run,Run,false,,5568843,"Mon, 4/20/2020",1587412255,2020-04-20T23:50:55+0000,Mon,9.03,9034.38,kilometers,km,42:32,2552,43:15,2595,false,https://d3o5xota0a1fcr.cloudfront.net/v6/maps/2DRNYUOF2TCJZBOST4DDHJVNUKR3N2NXF6LUQGX5ASLMCZYGOUQMGSM5LLOONZLQN53674BW3OXN4XWLMSV7EB2DNDRI66WK,true,false,20,m,19.669,,https://www.strava.com/activities/3328750276,https://www.strava.com/activities/3328750276?utm_content=36052432&utm_medium=referral&utm_source=twitter,went for a 9.0 kilometer Run.,false,false,,0,false,false,false,false,everyone
3324136705,A rainy one,Run,Run,Run,false,,5568843,"Sun, 4/19/2020",1587316916,2020-04-19T21:21:56+0000,Sun,17.20,17207.3,kilometers,km,1:18:42,4722,1:21:44,4904,false,https://d3o5xota0a1fcr.cloudfront.net/v6/maps/TL6UT5SBDDF5G5UM3TPLN3EJ2ZCMFCAQCDLMATYSNC664HFRHD6AEWXOAGSO6IZTITDCIJYXB64QFMFEZKHYYLHRXP2Q5RMB,true,false,35,m,35.4714,,https://www.strava.com/activities/3324136705,https://www.strava.com/activities/3324136705?utm_content=36052432&utm_medium=referral&utm_source=twitter,went for a 17.2 kilometer Run.,false,false,,2,false,false,false,false,everyone
3318722342,Evening Run,Run,Run,Run,false,,5568843,"Sat, 4/18/2020",1587234879,2020-04-18T22:34:39+0000,Sat,12.83,12838.9,kilometers,km,57:54,3474,59:07,3547,false,https://d3o5xota0a1fcr.cloudfront.net/v6/maps/SCS5T6SKTYM377W4CKKXKXCI7KDGCDGBXTI6DD6BDNC7MKX7FDXOCCMBO552XCC4ZGK2Q772JTIBFAM7HD7JDV2SQX5P76PN,true,false,18,m,17.9286,Not sure why the pace looks like that but oh well,https://www.strava.com/activities/3318722342,https://www.strava.com/activities/3318722342?utm_content=36052432&utm_medium=referral&utm_source=twitter,went for a 12.8 kilometer Run.,false,false,,0,false,false,true,false,everyone
3313789815,Progression Run,Run,Run,Run,false,,5568843,"Fri, 4/17/2020",1587147502,2020-04-17T22:18:22+0000,Fri,9.90,9905.36,kilometers,km,42:41,2561,45:18,2718,false,https://d3o5xota0a1fcr.cloudfront.net/v6/maps/ND2HC5WCUY3FHUC7D567OQL4DRMJDKA6NKBNBCRDRHDEKHQVVMWRNI52W2YFWAZJLWPHWSEZ34EKBUMVSF6LR7NGIX3NBZGJ,true,false,24,m,23.9348,,https://www.strava.com/activities/3313789815,https://www.strava.com/activities/3313789815?utm_content=36052432&utm_medium=referral&utm_source=twitter,went for a 9.9 kilometer Run.,false,false,,0,false,false,true,false,everyone
3309678583,4 x 100m hills & cooldown ,Run,Run,Run,false,,5568843,"Thu, 4/16/2020",1587066347,2020-04-16T23:45:47+0000,Thu,2.00,2000,kilometers,km,9:00,540,9:00,540,false,,false,false,0,m,0,,https://www.strava.com/activities/3309678583,https://www.strava.com/activities/3309678583?utm_content=36052432&utm_medium=referral&utm_source=twitter,went for a 2.0 kilometer Run.,false,false,,,false,false,false,false,everyone
3309629122,Evening Run,Run,Run,Run,false,,5568843,"Thu, 4/16/2020",1587063513,2020-04-16T22:58:33+0000,Thu,8.29,8292.37,kilometers,km,35:03,2103,35:36,2136,false,https://d3o5xota0a1fcr.cloudfront.net/v6/maps/FYMK353YP4EKGJX6PB3QLGMBNZAORDS2U4XJJBDC756QKMQ3YPVH4WAZSXLFGH6C7POCOCYOQRMSG7SFGBDHWVV4RTYLP3RI,true,false,21,m,21.1929,,https://www.strava.com/activities/3309629122,https://www.strava.com/activities/3309629122?utm_content=36052432&utm_medium=referral&utm_source=twitter,went for a 8.2 kilometer Run.,false,false,,0,false,false,true,false,everyone
3299038641,Afternoon Run,Run,Run,Run,false,,5568843,"Tue, 4/14/2020",1586871871,2020-04-14T17:44:31+0000,Tue,8.17,8178.56,kilometers,km,37:40,2260,38:34,2314,false,https://d3o5xota0a1fcr.cloudfront.net/v6/maps/PF24OFTHMUPSLAYUBK45E2MGLORXOTAFTK37F3NCRGUGQTG3AWLXCNTMLICLZVHYEUAYBEEE2FZ4H7AJTJ2BNJKYH4MR6BK3,true,false,19,m,18.9262,,https://www.strava.com/activities/3299038641,https://www.strava.com/activities/3299038641?utm_content=36052432&utm_medium=referral&utm_source=twitter,went for a 8.1 kilometer Run.,false,false,,0,false,false,true,false,everyone
3291325929,Afternoon Run,Run,Run,Run,false,,5568843,"Sun, 4/12/2020",1586712777,2020-04-12T21:32:57+0000,Sun,13.04,13044.8,kilometers,km,59:43,3583,1:01:14,3674,false,https://d3o5xota0a1fcr.cloudfront.net/v6/maps/FY5DAO74NS7OEWDYRO7Z5YX77RHVK7SUMWGYRTDLUMSA5VJ44O7UK67DVUWB25QPUYRG34OHO6INDWZMPNJXAAWAZZZ57P6E,true,false,19,m,18.6,,https://www.strava.com/activities/3291325929,https://www.strava.com/activities/3291325929?utm_content=36052432&utm_medium=referral&utm_source=twitter,went for a 13.0 kilometer Run.,false,false,,0,false,false,true,false,everyone
3286629779,Long Run,Run,Run,Run,false,,5568843,"Sat, 4/11/2020",1586624384,2020-04-11T20:59:44+0000,Sat,15.18,15187.7,kilometers,km,1:09:04,4144,1:11:03,4263,false,https://d3o5xota0a1fcr.cloudfront.net/v6/maps/BVPXXRVVOBBSRC3NJDK7443ZDMMD7SKDTJ6BSURF45EKYEGEE4LGVN4OOXYTSLXGQ2CNPBSOX5YLDYQ4K6BNFH33EOINSM2C,true,false,36,m,35.6357,,https://www.strava.com/activities/3286629779,https://www.strava.com/activities/3286629779?utm_content=36052432&utm_medium=referral&utm_source=twitter,went for a 15.1 kilometer Run.,false,false,,0,false,false,true,false,everyone
3281950869,A windy one,Run,Run,Run,false,,5568843,"Fri, 4/10/2020",1586542593,2020-04-10T22:16:33+0000,Fri,10.68,10683.2,kilometers,km,49:10,2950,56:33,3393,false,https://d3o5xota0a1fcr.cloudfront.net/v6/maps/E2LWIW6BM4J2C6OAZP5FFYIH3TN3RYJ6DDW3O55HIMXENZH2YAXAHONFHGBAU7DE55WAG2EHBGCTDB5D4UJPBCDYZOGQWHIX,true,false,22,m,22.2,10km + 6 strides. No pain today!,https://www.strava.com/activities/3281950869,https://www.strava.com/activities/3281950869?utm_content=36052432&utm_medium=referral&utm_source=twitter,went for a 10.6 kilometer Run.,false,false,,0,false,false,true,false,everyone
5629361195,5k twilight,Run,Run,Run,false,,7834038,"Wed, 7/14/2021",1626296070,2021-07-15T00:54:30+0000,Wed,5.00,5007,kilometers,km,17:14,1034,17:14,1034,false,https://d3o5xota0a1fcr.cloudfront.net/v6/maps/UU2PCC3GJCOOFWMFFOVP34NZTPV5MIJ5LSLRLS5DASDHIX6I6HWYIFEDX6F23VTHRUUXCPUBAPJ7LTG4RYM64SDK2A4DN7V7,true,false,46,m,45.7142,17:29,https://www.strava.com/activities/5629361195,https://www.strava.com/activities/5629361195?utm_content=36052432&utm_medium=referral&utm_source=twitter,went for a 5.0 kilometer Run.,true,false,,1,false,false,false,false,everyone
5629361158,warmup,Run,Run,Run,false,,7834038,"Wed, 7/14/2021",1626292931,2021-07-15T00:02:11+0000,Wed,4.01,4012.3,kilometers,km,18:34,1114,18:34,1114,false,https://d3o5xota0a1fcr.cloudfront.net/v6/maps/GZMGXY7SQJ5J2PZRD3BFG6IMINM6RMGRJ5CFXD6EVJGK7BVJ4FKJ2AGUZ22GS46JWRWCSLJY7YVUEZZEVUTJTWGMWX7RLNM7,true,false,32,m,31.6984,,https://www.strava.com/activities/5629361158,https://www.strava.com/activities/5629361158?utm_content=36052432&utm_medium=referral&utm_source=twitter,went for a 4.0 kilometer Run.,true,false,,0,false,false,false,false,everyone
5622285333,Evening Run,Run,Run,Run,false,,7834038,"Mon, 7/12/2021",1626117802,2021-07-12T23:23:22+0000,Mon,2.23,2231.2,kilometers,km,11:08,668,11:15,675,false,https://d3o5xota0a1fcr.cloudfront.net/v6/maps/B7WWKVNEQIPVJJ5BLKSY4PZHLWEYKIZP45CDHW72X3KUYJEMJQUGEYREQTVNGNAJLIMHV6ZBZY4AWDPWAJYWH7KZ3RZ2QEHP,true,false,27,m,26.9061,,https://www.strava.com/activities/5622285333,https://www.strava.com/activities/5622285333?utm_content=36052432&utm_medium=referral&utm_source=twitter,went for a 2.2 kilometer Run.,true,false,,,false,false,false,false,everyone
5622313211,5x1000m,Run,Run,Run,false,,7834038,"Mon, 7/12/2021",1626114035,2021-07-12T22:20:35+0000,Mon,5.00,5000,kilometers,km,17:20,1040,17:20,1040,false,,false,false,0,m,0,5k/tempo/1500/tempo/5k pace,https://www.strava.com/activities/5622313211,https://www.strava.com/activities/5622313211?utm_content=36052432&utm_medium=referral&utm_source=twitter,went for a 5.0 kilometer Run.,false,false,,3,false,false,false,false,everyone
5622284694,Afternoon Run,Run,Run,Run,false,,7834038,"Mon, 7/12/2021",1626111767,2021-07-12T21:42:47+0000,Mon,1.91,1914.1,kilometers,km,8:31,511,8:31,511,false,https://d3o5xota0a1fcr.cloudfront.net/v6/maps/6S4WHOQVV4MJPH43FTCQBRNFCX64T4OTBGKZ7OH7HDP3ERNFCQV2K7EV2XEM6KVZIFVV2PK7UHUIOIR6ZMS6LXPYL2NTELNO,true,false,6,m,6.00465,,https://www.strava.com/activities/5622284694,https://www.strava.com/activities/5622284694?utm_content=36052432&utm_medium=referral&utm_source=twitter,went for a 1.9 kilometer Run.,true,false,,,false,false,false,false,everyone
5622284540,Evening Run,Run,Run,Run,false,,7834038,"Sun, 7/11/2021",1626036737,2021-07-12T00:52:17+0000,Sun,1.91,1910.6,kilometers,km,8:49,529,8:49,529,false,https://d3o5xota0a1fcr.cloudfront.net/v6/maps/KTEKZXCDLOM2P3ZKYO6PGBHTXWWZSPHVD2C7JO6YMP2RQEMPBW7UDUOSTHEWBR4MXEVOWMH5S76LYU2TMQLRZKAQQB57B6BL,true,false,0,m,0,,https://www.strava.com/activities/5622284540,https://www.strava.com/activities/5622284540?utm_content=36052432&utm_medium=referral&utm_source=twitter,went for a 1.9 kilometer Run.,true,false,,,false,false,false,false,everyone
5622283902,Evening Run,Run,Run,Run,false,,7834038,"Sun, 7/11/2021",1626033977,2021-07-12T00:06:17+0000,Sun,8.16,8168.7,kilometers,km,36:27,2187,39:08,2348,false,https://d3o5xota0a1fcr.cloudfront.net/v6/maps/SILK5TQDEXUUIPJVI5XSGZ37Z54AFGKNAWF4BNEWLDW6K5SCI2EFS4GOVSJLQ3YQVN5T235VFCDWZU2BZSFMWJI7OZMG55SQ,true,false,8,m,8.06764,,https://www.strava.com/activities/5622283902,https://www.strava.com/activities/5622283902?utm_content=36052432&utm_medium=referral&utm_source=twitter,went for a 8.1 kilometer Run.,true,false,,,false,false,false,false,everyone
5597768059,Lunch Run,Run,Run,Run,false,,7834038,"Thu, 7/8/2021",1625744202,2021-07-08T15:36:42+0000,Thu,10.49,10491.5,kilometers,km,46:49,2809,48:24,2904,false,https://d3o5xota0a1fcr.cloudfront.net/v6/maps/GGB4ORVYHFS3DJFCY3IV65ESELOMPTKQH3AW2URQSBTXGJBDM5FN5BLIQD3W33ASQIDPUBUIMSF3Z37UVYKI7E42SVMV26KK,true,false,8,m,8.11524,,https://www.strava.com/activities/5597768059,https://www.strava.com/activities/5597768059?utm_content=36052432&utm_medium=referral&utm_source=twitter,went for a 10.4 kilometer Run.,true,false,,0,false,false,false,false,everyone
5581764647,3 x (3-2-1) + 3 min tempo + 2 x (3-2-1) + 3 min tempo + 1 x (3-2-1) ,Run,Run,Run,false,,7834038,"Mon, 7/5/2021",1625514793,2021-07-05T23:53:13+0000,Mon,8.10,8100,kilometers,km,36:00,2160,36:00,2160,false,,false,false,0,m,0,"100 jog between runs, 400 jog between sets
300s @1500: 48-52s
200s @1500 - 2s: 31-33s
100s fast
+ 2 X’s on the grass",https://www.strava.com/activities/5581764647,https://www.strava.com/activities/5581764647?utm_content=36052432&utm_medium=referral&utm_source=twitter,went for a 8.1 kilometer Run.,false,false,,3,false,false,false,false,everyone
5581770626,Evening Run,Run,Run,Run,false,,7834038,"Mon, 7/5/2021",1625512980,2021-07-05T23:23:00+0000,Mon,0.97,969.3,kilometers,km,5:36,336,5:36,336,false,https://d3o5xota0a1fcr.cloudfront.net/v6/maps/EHZKYCSABP6PSGRUPE5UH6WJRHKMNGKDHEBVXOIUANDSHPWM24MEG6FKO62E7TACUQXUC6L4WMCQCULEL6BTESUXM4EC3XOE,true,false,3,m,3.15694,,https://www.strava.com/activities/5581770626,https://www.strava.com/activities/5581770626?utm_content=36052432&utm_medium=referral&utm_source=twitter,went for a 0.9 kilometer Run.,true,false,,,false,false,false,false,everyone
5581770791,warmup,Run,Run,Run,false,,7834038,"Mon, 7/5/2021",1625507029,2021-07-05T21:43:49+0000,Mon,3.06,3059,kilometers,km,13:35,815,13:39,819,false,https://d3o5xota0a1fcr.cloudfront.net/v6/maps/3CDTHYJT6YSVMRY2E27CTXS7SINTTSFSQSVOPCV6F6RGTO6BBCJXG4ZML6PUZK4OOEDE37CIAAROBLDT2IMWJ3EASTU3FQWZ,true,false,23,m,23.3285,,https://www.strava.com/activities/5581770791,https://www.strava.com/activities/5581770791?utm_content=36052432&utm_medium=referral&utm_source=twitter,went for a 3.0 kilometer Run.,true,false,,0,false,false,false,false,everyone
5578533810,Evening Run,Run,Run,Run,false,,7834038,"Sun, 7/4/2021",1625422476,2021-07-04T22:14:36+0000,Sun,7.99,7998.5,kilometers,km,35:43,2143,39:04,2344,false,https://d3o5xota0a1fcr.cloudfront.net/v6/maps/U3R3COSZISCSIYXNQIKLECSXC2KN4ACC6R6VDXD4IIZRUJFVWNACQZQIQHXCUFOTLHCY5DIF5JLJHDIQYC2ZFEMRPEAYZNMD,true,false,7,m,7.32583,,https://www.strava.com/activities/5578533810,https://www.strava.com/activities/5578533810?utm_content=36052432&utm_medium=referral&utm_source=twitter,went for a 7.9 kilometer Run.,true,false,,,false,false,false,false,everyone
5569428703,cooldown,Run,Run,Run,false,,7834038,"Sat, 7/3/2021",1625310956,2021-07-03T15:15:56+0000,Sat,3.06,3068.9,kilometers,km,15:14,914,15:18,918,false,https://d3o5xota0a1fcr.cloudfront.net/v6/maps/P7PMVIC6FBQ5PAGTXGKKLTRQHOMYJVDBSNZFRQVTLCYSA3QHN3USQOBY3Y4ULDTS5EJVEJGGJKEAXE4UZYUV6VZ77HI56JCT,true,false,23,m,23.2914,,https://www.strava.com/activities/5569428703,https://www.strava.com/activities/5569428703?utm_content=36052432&utm_medium=referral&utm_source=twitter,went for a 3.0 kilometer Run.,true,false,,0,false,false,false,false,everyone
5569426248,strides on the grass,Run,Run,Run,false,,7834038,"Sat, 7/3/2021",1625310070,2021-07-03T15:01:10+0000,Sat,0.72,719.4,kilometers,km,3:00,180,3:07,187,false,https://d3o5xota0a1fcr.cloudfront.net/v6/maps/PCBNLDSFJNDI2KVWYI6V2TWQHTBDTRYH4I54PYEAOC2XU66EYGJ3JBB7T4U7KKAHPDIWDL4DDZOA3W5AHWYD7V772QYJDAIS,true,false,0,m,0,,https://www.strava.com/activities/5569426248,https://www.strava.com/activities/5569426248?utm_content=36052432&utm_medium=referral&utm_source=twitter,went for a 0.7 kilometer Run.,true,false,,0,false,false,false,false,everyone
5569457659,"5 x 1km @3k+2 pace, 2:45 rest",Run,Run,Run,false,,7834038,"Sat, 7/3/2021",1625307614,2021-07-03T14:20:14+0000,Sat,5.00,5000,kilometers,km,16:10,970,16:10,970,false,,false,false,0,m,0,"3:17, 3:16, 3:14, 3:12, 3:10",https://www.strava.com/activities/5569457659,https://www.strava.com/activities/5569457659?utm_content=36052432&utm_medium=referral&utm_source=twitter,went for a 5.0 kilometer Run.,false,false,,3,false,false,false,false,everyone
5569428625,warmup ,Run,Run,Run,false,,7834038,"Sat, 7/3/2021",1625305096,2021-07-03T13:38:16+0000,Sat,2.58,2585,kilometers,km,11:49,709,12:09,729,false,https://d3o5xota0a1fcr.cloudfront.net/v6/maps/5C7QSCZLMIOX6E3CPQEDRS5DAGXSGMJM4MGR3PCI66YS4LH2C6BV4G7MOIW5SWH5MB5O6VTBSRNVEYOR5QH3QQ5XNGBQICMQ,true,false,11,m,11.4747,,https://www.strava.com/activities/5569428625,https://www.strava.com/activities/5569428625?utm_content=36052432&utm_medium=referral&utm_source=twitter,went for a 2.5 kilometer Run.,true,false,,0,false,false,false,false,everyone
5569428731,Afternoon Run,Run,Run,Run,false,,7834038,"Fri, 7/2/2021",1625231240,2021-07-02T17:07:20+0000,Fri,10.43,10431,kilometers,km,46:02,2762,48:41,2921,false,https://d3o5xota0a1fcr.cloudfront.net/v6/maps/ZOKSK7IMD66GR3VNDRIYOUO2QPMHCKC4ESEMIQ3VNSC4WNFGYITCLXVKY4SSDUAJPFXYRDU4ZPCP4FW2AFI6AFQRGLBMZDSV,true,false,8,m,8.07476,,https://www.strava.com/activities/5569428731,https://www.strava.com/activities/5569428731?utm_content=36052432&utm_medium=referral&utm_source=twitter,went for a 10.4 kilometer Run.,true,false,,,false,false,false,false,everyone
5559563241,Afternoon Run,Run,Run,Run,false,,7834038,"Thu, 7/1/2021",1625144732,2021-07-01T17:05:32+0000,Thu,3.49,3493,kilometers,km,16:29,989,18:13,1093,false,https://d3o5xota0a1fcr.cloudfront.net/v6/maps/MEBEMPEO5LYBUF3WN67T6T4DAYMTJAAWDBNI6VYJT5I6A22HKE2L56PO4JBV2UMFYFUIYGMJE25RZHR65B2BI464MWFCQKZF,true,false,0,m,0,,https://www.strava.com/activities/5559563241,https://www.strava.com/activities/5559563241?utm_content=36052432&utm_medium=referral&utm_source=twitter,went for a 3.4 kilometer Run.,true,false,,,false,false,false,false,everyone
5559563249,Lunch Run,Run,Run,Run,false,,7834038,"Thu, 7/1/2021",1625143176,2021-07-01T16:39:36+0000,Thu,4.98,4986.3,kilometers,km,19:26,1166,19:30,1170,false,https://d3o5xota0a1fcr.cloudfront.net/v6/maps/ZJFEG3Y2E2I4WRJBDZOTPCEPXWTRS5ENT3HYHVMJTCUDHE4TE6KG2SRSFUSZB5MC4O7GROL5BMQ6ZWDHX6XMK4AZJNAFF266,true,false,0,m,0,,https://www.strava.com/activities/5559563249,https://www.strava.com/activities/5559563249?utm_content=36052432&utm_medium=referral&utm_source=twitter,went for a 4.9 kilometer Run.,true,false,,,false,false,false,false,everyone
5559563078,Lunch Run,Run,Run,Run,false,,7834038,"Thu, 7/1/2021",1625142122,2021-07-01T16:22:02+0000,Thu,3.38,3386,kilometers,km,15:00,900,15:47,947,false,https://d3o5xota0a1fcr.cloudfront.net/v6/maps/HE6TC4JBBHHKNJXDIMRS3K2PVNLAR33P3IFCD3UEQRTEGO6VXHGDLZISYC5PUODYN2P2N5JXHYRWWQTJIH6EQWJ25UTPQL3X,true,false,5,m,4.86875,,https://www.strava.com/activities/5559563078,https://www.strava.com/activities/5559563078?utm_content=36052432&utm_medium=referral&utm_source=twitter,went for a 3.3 kilometer Run.,true,false,,,false,false,false,false,everyone
6166082210,Afternoon Run,Run,Run,Run,false,,7834038,"Mon, 10/25/2021",1635174250,2021-10-25T19:04:10+0000,Mon,9.43,9431.87,kilometers,km,47:03,2823,54:56,3296,false,https://d3o5xota0a1fcr.cloudfront.net/v6/maps/PVMV7VTZAXNVLLY3IMFLPZGO2Z4HEQASXON77YIUWTLYKRHDPSEHZCWRZO4CEGU2SD2LAKCYP5774WDGPBQ5XEHKJGZD5ZDU,true,false,63,m,62.5667,,https://www.strava.com/activities/6166082210,https://www.strava.com/activities/6166082210?utm_content=36052432&utm_medium=referral&utm_source=twitter,went for a 9.4 kilometer Run.,true,false,,,false,false,false,false,everyone
6155380966,Afternoon Run,Run,Run,Run,false,,7834038,"Fri, 10/22/2021",1634914549,2021-10-22T18:55:49+0000,Fri,2.42,2424.02,kilometers,km,15:13,913,15:13,913,true,,false,false,0,m,0,,https://www.strava.com/activities/6155380966,https://www.strava.com/activities/6155380966?utm_content=36052432&utm_medium=referral&utm_source=twitter,went for a 2.4 kilometer Run.,true,false,,,false,false,false,false,everyone
6155378817,3 x (200+200+1 mile),Run,Run,Run,false,,7834038,"Fri, 10/22/2021",1634872800,2021-10-22T07:20:00+0000,Fri,6.60,6600,kilometers,km,24:45,1485,24:45,1485,false,,false,false,0,m,0,First track workout in a while. 3 mins rest between sets.,https://www.strava.com/activities/6155378817,https://www.strava.com/activities/6155378817?utm_content=36052432&utm_medium=referral&utm_source=twitter,went for a 6.6 kilometer Run.,false,false,,,false,false,false,false,everyone
6142865659,Afternoon Run,Run,Run,Run,false,,7834038,"Wed, 10/20/2021",1634744567,2021-10-20T19:42:47+0000,Wed,10.09,10091.9,kilometers,km,49:45,2985,52:50,3170,false,https://d3o5xota0a1fcr.cloudfront.net/v6/maps/2JMSZEB3KDHBVB2AJJ5LBFVHKXH3NMIM53TJJKN7HN2MBCHFAXJ64ZXVUN4VPSGDBDTPPHGWLUHS66SS4Z2DQVWTMMOH3O5L,true,false,53,m,53.3,,https://www.strava.com/activities/6142865659,https://www.strava.com/activities/6142865659?utm_content=36052432&utm_medium=referral&utm_source=twitter,went for a 10.0 kilometer Run.,false,false,,,false,false,false,false,everyone
6094496299,Afternoon Run,Run,Run,Run,false,,7834038,"Sun, 10/10/2021",1633876600,2021-10-10T18:36:40+0000,Sun,12.05,12057.5,kilometers,km,50:11,3011,53:02,3182,false,https://d3o5xota0a1fcr.cloudfront.net/v6/maps/HFBPKU6L5VZYR5B4UZPI72NZ6E32URDEYO22K2QSQBW3Q54VDMQL4ECPBRFPKTGM4633OI7G6IRNEDAMYJ5S4VSMROIAXBCV,true,false,8,m,8.37981,,https://www.strava.com/activities/6094496299,https://www.strava.com/activities/6094496299?utm_content=36052432&utm_medium=referral&utm_source=twitter,went for a 12.0 kilometer Run.,true,false,,,false,false,false,false,everyone
6093503953,Back in Ottawa!,Run,Run,Run,false,,7834038,"Sat, 10/9/2021",1633813091,2021-10-10T00:58:11+0000,Sat,10.56,10561.4,kilometers,km,59:18,3558,1:17:45,4665,false,https://d3o5xota0a1fcr.cloudfront.net/v6/maps/ALRWKTBF4N4YUQKGR7T4YJ7SNYTTCBSAIFOI2SSEYUCJ2ZD3HAJBA7FPWDSOH2SSHT3MOEQLPFELEWGC3B3PZM46EXPNVFGD,true,false,18,m,18.4982,shakeout with Elana,https://www.strava.com/activities/6093503953,https://www.strava.com/activities/6093503953?utm_content=36052432&utm_medium=referral&utm_source=twitter,went for a 10.5 kilometer Run.,true,false,,0,false,false,false,false,everyone
6074603400,Afternoon Run,Run,Run,Run,false,,7834038,"Wed, 10/6/2021",1633533141,2021-10-06T19:12:21+0000,Wed,9.80,9805.2,kilometers,km,52:38,3158,57:54,3474,false,https://d3o5xota0a1fcr.cloudfront.net/v6/maps/PH6DHPXPG7JC57TAGBAFMOKXQSHIG7NXV5NUORHPTWQAPUPPCRZV366VJY6AYGPGUNCYHFFEOFUSLLUSLFF4GD6EHELXNWS2,true,false,48,m,48.4754,,https://www.strava.com/activities/6074603400,https://www.strava.com/activities/6074603400?utm_content=36052432&utm_medium=referral&utm_source=twitter,went for a 9.8 kilometer Run.,true,false,,,false,false,false,false,everyone
6069425694,Evening Run,Run,Run,Run,false,,7834038,"Mon, 10/4/2021",1633371394,2021-10-04T22:16:34+0000,Mon,8.97,8978.1,kilometers,km,52:39,3159,55:20,3320,false,https://d3o5xota0a1fcr.cloudfront.net/v6/maps/2TMS3QCQ5VDLOSVQQ4CFM7XMRU2S34SBTRPKH7UWVTKXO6WJTRFLEL67RC74P63UOHUKS24Y3BEG6RFOPDSNEZMC5Y3N534Q,true,false,48,m,47.7401,,https://www.strava.com/activities/6069425694,https://www.strava.com/activities/6069425694?utm_content=36052432&utm_medium=referral&utm_source=twitter,went for a 8.9 kilometer Run.,true,false,,,false,false,false,false,everyone
6069425537,Afternoon Run,Run,Run,Run,false,,7834038,"Fri, 10/1/2021",1633104474,2021-10-01T20:07:54+0000,Fri,7.62,7623.7,kilometers,km,39:00,2340,39:21,2361,false,https://d3o5xota0a1fcr.cloudfront.net/v6/maps/2A4WUOYTN7YQAJRZU3BN5ZTEBU53XICNQR7LQSQ2CM323A3NYMKJGEKHE6CR4HXG2WKQK3CVSLOAA2QAWJNAG5CBFWMCURBN,true,false,39,m,39.4908,,https://www.strava.com/activities/6069425537,https://www.strava.com/activities/6069425537?utm_content=36052432&utm_medium=referral&utm_source=twitter,went for a 7.6 kilometer Run.,true,false,,,false,false,false,false,everyone
6040005800,Afternoon Run,Run,Run,Run,false,,7834038,"Wed, 9/29/2021",1632931665,2021-09-29T20:07:45+0000,Wed,11.26,11262.5,kilometers,km,1:01:41,3701,1:06:01,3961,false,https://d3o5xota0a1fcr.cloudfront.net/v6/maps/IPUTY4KSS7BOIVGOR2HRUDTHCBJDHSZ3YPL5WRP5VP6DT4BWH6ETZDYFQS4JA5JC53UKOVXN466FYYRY5K255CXDZ2P7RWU3,true,false,55,m,54.7303,,https://www.strava.com/activities/6040005800,https://www.strava.com/activities/6040005800?utm_content=36052432&utm_medium=referral&utm_source=twitter,went for a 11.2 kilometer Run.,true,false,,,false,false,false,false,everyone
6029442163,Afternoon Run,Run,Run,Run,false,,7834038,"Mon, 9/27/2021",1632759109,2021-09-27T20:11:49+0000,Mon,7.88,7887.8,kilometers,km,43:03,2583,48:00,2880,false,https://d3o5xota0a1fcr.cloudfront.net/v6/maps/WRVSFQ2QOAGAA6U35ZQNXA7R6CZA7XWJP4UWPMGCW54RMYUJK3B5SAVFNNHRK36Y5L74MEP6QHI7KNUJMOVME5F7OR5LCICG,true,false,42,m,41.5953,,https://www.strava.com/activities/6029442163,https://www.strava.com/activities/6029442163?utm_content=36052432&utm_medium=referral&utm_source=twitter,went for a 7.8 kilometer Run.,true,false,,,false,false,false,false,everyone
6029442023,Lunch Run,Run,Run,Run,false,,7834038,"Sun, 9/26/2021",1632658747,2021-09-26T16:19:07+0000,Sun,3.11,3116.9,kilometers,km,14:03,843,15:52,952,false,https://d3o5xota0a1fcr.cloudfront.net/v6/maps/JGQWOX7YKPAHXCGGEYN266T2MXAQ43ZXPPWXEWMBDO6PFM2CKN3QT2MDAP3Z7UHSMNSVOXWONBIGII5B2YVRACXUUZ2MYOMC,true,false,36,m,36.1547,,https://www.strava.com/activities/6029442023,https://www.strava.com/activities/6029442023?utm_content=36052432&utm_medium=referral&utm_source=twitter,went for a 3.1 kilometer Run.,true,false,,,false,false,false,false,everyone
6029442029,Lunch Run,Run,Run,Run,false,,7834038,"Sun, 9/26/2021",1632656771,2021-09-26T15:46:11+0000,Sun,5.85,5854.5,kilometers,km,26:37,1597,28:32,1712,false,https://d3o5xota0a1fcr.cloudfront.net/v6/maps/INQLBKTQMQRWWDGFB4L7Z7MYQEUB3R7ZVJYFNAS5BI7HFS4VMKOBZBDHKOFVJMGTTKFEE5XGWQWYBTMGMETZJGGTOD3PCJR4,true,false,23,m,23.08,,https://www.strava.com/activities/6029442029,https://www.strava.com/activities/6029442029?utm_content=36052432&utm_medium=referral&utm_source=twitter,went for a 5.8 kilometer Run.,true,false,,,false,false,false,false,everyone
